input,output
"input: 1. With effect from 1 July 1972, the Staff Regulations of Officials of the European Communities shall be amended as follows:    (a) Article 67In paragraph 1 (a) the words 'household allowance' shall be substituted for 'head of household allowance'.(b) Article 69The words 'household allowance' shall be substituted for 'head of household allowance'.(c) Article 74In paragraph 3 the following shall be substituted for the last sentence:'Where both parents are officials of the Communities, the grant shall be paid to the mother only.'(d) Article 81In the first subparagraph the words 'household allowance' shall be substituted for 'head of household allowance'.(e) Article 105In paragraph 2, second indent, the words 'household allowance' shall be substituted for 'head of household allowance'.(f) ANNEX VII The following shall be substituted for Article 1:'1. The household allowance shall be fixed at 5 % of the basic salary of an official or Bfrs 1 183, whichever is the greater.2. The household allowance shall be granted to:    (a) a married official;(b) an official who is widowed, divorced, legally separated or unmarried and has one or more dependent children within the meaning of Article 2 (2) and (3) below;(c) by special reasoned decision of the appointing authority based on supporting documents, an official who, while not fulfilling the conditions laid down in (a) and (b), nevertheless actually assumes family responsibilities.  (1)OJ No L 56, 4.3.1968, p. 1. (2)OJ No L 283, 20.12.1972, p. 1.3. If the spouse of an official is gainfully employed, with an annual income, before deduction of tax, of more than Bfrs 250 000, the official entitled to the household allowance shall not receive this allowance save by special decision of the appointing authority. The official shall, however, be entitled to the allowance where the married couple have one or more dependent children.4. In cases where, under the foregoing provisions, a husband and wife employed in the service of the Communities are both entitled to the household allowance, this shall be payable only to the person whose basic salary is the higher.'(g) ANNEX VII In Article 4 (1), subparagraph 1, the words 'household allowance' shall be substituted for 'head of household allowance', and the words 'paid to the Established Official' shall be substituted for the words 'to which the Established Official is entitled'.Paragraphs 2 and 3 shall be deleted.(h)  ANNEX VII In Article 5 (1), (3) second subparagraph, and (4), the words : 'is entitled to the household allowance' shall be substituted for 'is a head of household';   - In paragraph 1 the following subparagraph shall be inserted between the present first and second subparagraphs:'In cases where a husband and wife who are officials of the European Communities are both entitled to the settlement allowance, this shall be payable only to the person whose basic salary is the higher.'(i)  ANNEX VII - In the first subparagraph of paragraph 1, the words : 'who is entitled to the household allowance' shall be substituted for 'who is a head of household'.- In the first subparagraph of paragraph 1, the following sentence shall be added : 'In cases where a husband and wife who are officials of the Communities are both entitled to the resettlement allowance, this shall be payable only to the person whose basic salary is the higher.'(j)  ANNEX VII - In the first subparagraph of paragraph 1, the words : 'if he is entitled to the household allowance' shall be substituted for 'if he is a head of household.'- In paragraph 1, the following new subparagraph shall be inserted after the first subparagraph:'Where a husband and wife are both officials of the Communities, each has the right in respect of himself or herself and in respect of dependants to the flat-rate payment of travelling expenses, in accordance with the above provisions ; each dependant shall be entitled to one payment only. The payment in respect of dependent children is fixed at the request of the husband or wife, on the basis of the place of origin of one or other of them.'- In the second subparagraph of paragraph 1, the words : 'as being entitled to the household allowance' shall be substituted for 'as being a head of household'.(k)  ANNEX VII 0    - In the first subparagraph of paragraph 1 and in paragraph 2 (a) and (b) the words : 'entitled to the household allowance', 'not entitled to the household allowance', 'who is entitled to the household allowance', and 'who is not entitled to the household allowance' shall be substituted for 'head of household', 'not head of household', 'who is not head of household' and 'who is head of household'.- In the first subparagraph of paragraph 1, the following sentence shall be added:  'Where a husband and wife who are officials of the European Communities are both entitled to the daily subsistence allowance, the rates shown in the first two columns shall be applicable only to the person whose basic salary is the higher. The rates shown in the other two columns shall be applicable to the other person.'-  In paragraph 2, insert the following subparagraph:'In cases where a husband and wife who are officials of the European Communities are  both entitled to the basic subsistence allowance, the period in respect of which it is granted as laid down in (b) shall apply to the person whose basic salary is the higher. The period laid down in (a) shall apply to the other person.'2. With effect from 1 July 1972, the Conditions of Employment of Other Servants of the European Communities shall be amended as follows: 4    - In paragraph 3, the words 'who is entitled to the household allowance' and 'who is not entitled to the household allowance' shall be substituted for 'who is a head of household' and 'who is not a head of household'.- In paragraph 3, the following subparagraph shall be added:'In cases where a husband and wife who are members of the temporary staff of the Communities are both entitled to the settlement allowance or resettlement allowance, this shall be payable only to the person whose basic salary is the higher.' 1. With effect from the first day of the month following that in which this Regulation is published in the Official Journal of the European Communities, the Staff Regulations of Officials of the European Communities shall be amended as follows:    (a) Article 72  The following sentence shall be added after the first sentence of the first subparagraph:'However, the rate of 80 % shall be raised to 100 % in cases of tuberculosis, poliomyelitis, cancer, mental illness and other illnesses recognized by the appointing authority as of comparable seriousness.'(b) ANNEX VII Article 6 The following shall be substituted for Article 6 (2):'2. In the event of the death of an established official, the resettlement allowance shall be paid to the surviving spouse or, in the absence of such a person, to the dependants within the meaning of Article 2 above, even if the requirement as to length of service laid down in paragraph 1 is not satisfied.'2. With effect from the first day of the month following that in which this Regulation is published in the Official Journal of the European Communities, the Conditions of Employment of Other Servants of the European Communities shall be amended as follows: 5 At Article 65 the following new first subparagraph shall be added:'Article 67 (1) (a) and (b), (2) and (3) and Article 69 of the Staff Regulations, concerning the household allowance, the dependent child allowance and the expatriation allowance, shall apply by analogy.' This Regulation shall enter into force on the day following its publication in the Official Journal of the European Communities.This Regulation shall be binding in its entirety and directly applicable in all Member States.
output: ","Regulation amending Regulation (EEC, Euratom, ECSC) No 259/68 fixing the Staff Regulations of the Officials and Conditions of Employment applicable to other Servants of the European Communities"
"input: Council Regulation (EEC, Euratom, ECSC) No 260/68 of 29 February 1968 shall be amended as follows:The words ‘household allowance’ shall be substituted for ‘head of household allowance’ in Article 3 (3) (a) first indent. This Regulation shall into enter force on the day following its publication in the Official Journal of the European Communities.It shall be applicable from 1 July 1972.This Regulation shall be binding in its entirety and directly applicable in all Member States.
output: ","Regulation amending Council Regulation (EEC, Euratom, ECSC) No 260/68 of the Council laying down the conditions and procedure for applying the tax for the benefit of the European Communities"
"input: The export refunds laid down in Article 9 of Regulation Nos 122/67/EEC and 123/67/EEC shall, on application, be fixed in advance for the products listed in the Annex. Commission Regulation (EEC) No 571/70 (10) of 26 March 1970 determining the list of egg products covered by the provisions for the advance fixing of export refunds and the destination of such products, as last amended by Regulation No 345/71 (11), is repealed. This Regulation shall enter into force on 1 March 1973.This Regulation shall be binding in its entirety and directly applicable in all Member States.
output: ",Regulation establishing egg and poultrymeat products eligible for the advance fixing of export refunds
"input: The fourth indent of Article 1 (3) of Regulation (EEC) No 2223/70 is replaced by the following:- 'Austria'. This Regulation shall enter into force on the third day following its publication in the Official Journal of the European Communities.This Regulation shall be binding in its entirety and directly applicable in all Member States.
output: ",Regulation amending Regulation (EEC) No 2223/70 waiving the countervailing duty on imports of certain wines originating in and coming from certain third countries
"input: The Protocol fixing certain provisions relating to the Agreement between the European Economic Community and the State of Israel, the text of which is annexed hereto, is concluded, on behalf of the Community. The President of the Council shall, pursuant to Article 3 of the Protocol, inform the other Contracting Party that the procedures necessary for the entry into force of the Protocol have been completed on the part of the Community [2]. This Regulation shall enter into force on the third day following its publication in the Official Journal of the European Communities.This Regulation shall be binding in its entirety and direotly applicable in all Member States.
output: ",Regulation on the conclusion of the Protocol fixing certain provisions relating to the Agreement between the European Economic Community and the state of Israel in consequence of the accession of the new member states to the European community
"input: The following shall be substituted for the first subheading of Article 1 (1) of Regulation (EEC) No 1105/68:'1. Aid may be granted for skimmed milk produced and processed in the dairy if the skimmed milk:    - either has been denatured by one of the methods referred to in Article 2 and if its specific gravity before denaturing was at least 1.03,- or has been subject to administrative control offering safeguards equivalent to denaturing.' 1. The following shall be substituted for Article 6 (2) (b) of Regulation (EEC) No 1105/68:'(b) sell their own butter production or deliver cream for direct consumption to retailers or consumers, the statement shall be sent to the competent authority.'2. The following Article 8a shall be inserted after Article 8 of Regulation (EEC) No 1105/68:'Article 8a1. Without prejudice to the provisions of paragraph 3, breeders who use their own skimmed milk for feeding their animals and sell cream to retailers or consumers shall, for each kilogramme of milk fat sold, receive the aid corresponding to 23 kilogrammes of skimmed milk.2. Aid shall be granted only to breeders registered as cream sellers.  (1)OJ No L 148, 28.6.1968, p. 13. (2)OJ No L 73, 27.3.1972, p. 14. (3)OJ No L 73, 27.3.1972, p. 5. (4)OJ No L 169, 18.7.1968, p. 4. (5)OJ No L 118, 20.5.1972, p. 21. (6)OJ No L 184, 29.7.1968, p. 24. (7)OJ No L 79, 1.4.1972, p. 83.Registration shall be effected by the agency of the Member State competent to grant aid. This agency shall issue a registration card which shall indicate the number of cows whose milk is used for cream production.3. Aid shall be granted only for a quantity of skimmed milk not exceeding a maximum yearly quantity for each cow mentioned on the registration card.The maximum yearly quantity shall be 2 800 kilogrammes of skimmed milk per cow. The quantity of milk delivered by the breeder to a dairy or to final consumers shall, however, be deducted from that figure.4. Breeders shall receive aid only if they account for the quantity of cream produced and sold as well as for the growth of their livestock by suitable documentation.' This Regulation shall enter into force on the third day following its publication in the Official Journal of the European Communities.This Regulation is applicable from 1 February 1973.This Regulation shall be binding in its entirety and directly applicable in all Member States.
output: ",Regulation amending Regulation (EEC) No 1105/68 on detailed rules for granting aid for skimmed milk for use as feed
"input: 1. Community rules applicable to the United Kingdom for trade in agricultural products covered by Annex II to the Treaty establishing the European Economic Community and in goods covered by Regulation No 170/67/EEC and Regulation (EEC) No 1059/69, shall apply to the islands, with the exception of rules on refunds and on compensatory amounts granted on exports by the United Kingdom.2. For the purpose of applying the rules referred to in paragraph 1, the United Kingdom and the islands shall be treated as a single Member State.3. No refund or compensatory amount shall be granted in respect of the products referred to in paragraph 1, originating in or coming from these islands, in respect of which customs formalities are completed in a Member State.4. Where the products referred to in paragraph 1 are exported to third countries, the islands may not grant aid in excess of the refunds or compensatory amounts which may be granted by the United Kingdom, in accordance with Community rules, on exports to third countries.5. Where the products referred to in paragraph 1 are exported to Member States, the islands may not grant aid in excess of any amounts which may be granted by the United Kingdom, in accordance with Community rules, on exports to other Member States. As far as aids other than those referred to in Article 1 are concerned, the provisions of Article 93 (1) and the first sentence of Article 93 (3) of the treaty establishing the European Economic Community shall apply.The Council, acting by a qualified majority on a proposal from the Commission, shall make the other provisions of Articles 92, 93 and 94 of the Treaty applicable insofar as this proves necessary. As from 1 September 1973, the Community rules applicable in the matter of:    - veterinary legislation,- animal health legislation,- plant health legislation,- marketing of seeds and seedlings,- food legislation,- feedingstuffs legislation,- quality and marketing standards,shall apply under the same conditions as in the United Kingdom to the products referred to in Article 1 imported into the islands or exported from the islands to the Community, the veterinary legislation being applicable under the same conditions as in the United Kingdom in respect of Northern Ireland. Detailed rules for the application of Article 1, in particular rules to prevent deflections of trade, shall be adopted in accordance with the procedure laid down in Article 26 of Council Regulation No 120/67/EEC (1) of 13 June 1967 on the common organization of the market in cereals as last amended by the Act of Accession or in the corresponding Article of other Regulations on the common organization of markets as the case may be. This Regulation shall enter into force on the day of its publication in the Official Journal of the European Communities.This Regulation shall be binding in its entirety and directly applicable in all Member States.
output: ",Regulation concerning the Community arrangements applicable to the Channel Islands and the Isle of Man for trade in agricultural products
"input: Article 2 (1) of Regulation (EEC) No 2552/69 of 17 December 1969 is replaced by the following:'1. The certificate shall be in the form set out in Annex I to this Regulation. The size of the certificate shal be approximately 21 cm x 30 cm. White paper with a yellow border shall be used.' Article 7 of Regulation (EEC) No 2552/69 of 17 December 1969 is deleted. Annexes I and II to Regulation (EEC) No 2552/69 of 17 December 1969 are replaced by Annexes I and II to this Regulation. This Regulation shall enter into force on 1 April 1973. Nevertheless, Bourbon whiskey may, up to and including 30 June 1973, continue to be admitted under subheading No 22.09 C III a) upon presentation of a certificate of authenticity meeting the requirements specified in Regulation (EEC) No 2552/69 of 17 December 1969 as it applies up to and including 31 March 1973.This Regulation shall be binding in its entirety and directly applicable in all Member States.
output: ",Regulation amending Regulation (EEC) No 2552/69 of 17 December 1969 determining the conditions for the admission of Bourbon whiskey under subheading No 22.09 C III a) of the Common Customs Tariff
"input: The producer Member States shall institute arrangements for the registration of contracts to supply hops concluded between a producer or recognized producer group and a buyer. Such registration shall apply solely to contracts in respect of hops harvested in the Member State concerned. Contracts concluded in advance shall be concluded in writing. A copy of each contract concluded in advance shall be communicated by the producer or recognized producer group to the bodies designated by each Member State to register contracts within one month of its conclusion. The body referred to in Article 2 shall register all deliveries effected, distinguishing in so doing between contracts concluded in advance and contracts not so concluded. Registration shall be on the basis of a duplicate of the receipted invoice to be communicated by the seller to the said body. The seller may communicate such duplicates either as and when deliveries are effected or all together, but must in any event communicate them by 15 March. Each Member State shall communicate to the Commission by 31 March and for the first time by 31 March 1974 the following data for each recognized producer region and each variety:    (a) for the harvest of the current calendar year and each succeeding harvest:      - the amounts of hops which are the subject of contracts concluded in advance;- the average prices per 50 kilogrammes;  (1)OJ No L 175, 4.8.1971, p. 1. (2)OJ No L 148, 30.6.1972, p. 11.(b) for all deliveries effected in connection with the harvest of the previous calendar year, distinguishing in so doing between contracts concluded in advance and contracts not so concluded:      - the amounts of hops delivered;- the average prices per 50 kilogrammes. Registration of contracts shall apply for the first time to all contracts in respect of the 1973 harvest. Each Member State shall communicate to the Commission by 31 March of each year at latest for each recognized producer region and each variety:    (a) the total area planted (in hectares) declared under Article 1 of Regulation (EEC) No 1350/72;(b) the amounts harvested. This Regulation shall enter into force on the day following its publication in the Official Journal of the European Communities.This Regulation shall be binding in its entirety and directly applicable in all Member States.
output: ",Regulation on registration of contracts and communication of data with respect to hops
"input: Article 4 of Regulation (EEC) No 1698/70 is replaced by the following:'Until the appropriate Community provisions are adopted, Member States shall take the necessary measures to ensure control of the making of wine from the grapes and musts referred to in Article 1.' This Regulation shall enter into force on the third day following its publication in the Official Journal of the European Communities.This Regulation shall be binding in its entirety and directly applicable in all Member States.
output: ",Regulation amending Regulation (EEC) No 1698/70 in order to align the provisions thereof on the accompanying documents introduced for wine by Regulation (EEC) No 1769/72
"input: A European Monetary Cooperation Fund, hereinafter referred to as 'the Fund', is hereby established ; it shall have legal personality. Within the limits of its powers the Fund shall promote:    - the proper functioning of the progressive narrowing of the margins of fluctuation of the Community currencies against each other;- interventions in Community currencies on the exchange markets;- settlements between Central Banks leading to a concerted policy on reserves.  (1)OJ No C 28, 27.3.1971, p. 1. (2)OJ No C 38, 18.4.1972, p. 3. In the first stage of its functions the Fund shall be responsible for:    - the concerted action necessary for the proper functioning of the Community exchange system;- the multilateralization of positions resulting from interventions by Central Banks in Community currencies and the multilateralization of intra-Community settlements;- the administration of the very short-term financing provided for by the Agreement between the Central Banks of the enlarged Community of 10 April 1972 and of the short-term monetary support provided for in the Agreement between the Central Banks of the Community of 9 February 1970, to which the Central Banks of Denmark, Ireland and the United Kingdom acceded with effect from 8 January 1973, and the regroupment of these mechanisms in a renewed mechanism. The provisions contained in the Agreements referred to in the third indent of Article 3 shall become the administrative rules of the Fund. The necessary technical adaptations to those provisions shall be made by the Board of Governors of the Fund without however changing the basic nature of those provisions and in particular the consultation procedures contained therein. The Statutes of the Fund are set out in the Annex to this Regulation and form an integral part thereof. This Regulation shall enter into force on 6 April 1973.This Regulation shall be binding in its entirety and directly applicable in all Member States.
output: ",Regulation establishing a European Monetary Cooperation Fund
"input: The text of the provisions relating to goods in respect of which a movement certificate A.S.1 may be issued shall appear on the certificate and shall be that set out in the Annex to this Regulation. Movement certificates issued in Denmark may include additional explanatory notes in relation to the application of Article 25 of Protocol 3 to the Agreement between the European Economic Community and the Kingdom of Sweden. Movement certificates already printed by the Member States may be used until stocks are exhausted. This Regulation shall enter into force on the third day following its publication in the Official Journal of the European Communities.This Regulation shall be binding in its entirety and directly applicable in all Member States.
output: ","Regulation on the application of Protocol No 3 on the definition of ' originating products' and on the methods of administrative cooperation, annexed to the Agreement between the European Economic Community and the Kingdom of Sweden"
"input: Subparagraphs (a) and (b) of Article 6 (2) of Regulation (EEC) No 685/69 are replaced by the following:' (a) 10 units of account for fixed costs;(b) 0 720 unit of account per day for cold storage costs;(c) an amount per day of storage calculated on the basis of the buying-in price for butter applied by the intervention agency in the relevant Member State on the day on which the contract is made, plus interest at 8 % per annum;For the purpose of calculating the amount of the costs specified in (b) and (c), the number of days to be taken into account shall be the number of days from and including the day of entry into store until and including the day of removal.' Article 24 (1) of Regulation (EEC) No 685/69 is replaced by the following:'1. The private storage aid provided for in Article 6 (2) of Regulation (EEC) No 804/68 shall be calculated per metric ton of butter equivalent as follows:    (a) 10 units of account for fixed costs;(b) 0 720 unit of account per day for cold storage costs;(c) an amount per day of storage calculated on the basis of the buying-in price for butter applied by the intervention agency in the relevant Member State on the day on which the contract is made, plus interest at 8 % per annum.(d) 30 units of account where the product is stored for not less than four months.For the purpose of calculating the amount of the costs specified in (b) and (c), the number of days to be taken into account shall be the number of days from and including the day of  (1)OJ No L 148, 28.6.1968, p. 13. (2)OJ No L 73, 27.3.1972, p. 14. (3)OJ No L 73, 27.3.1972, p. 5. (4)OJ No L 90, 15.4.1969, p. 12. (5)OJ No L 39, 12.2.1973, p. 35.entry into store until and including the day of removal. However, the amount to be taken into account shall not exceed that corresponding to a storage period of 180 days.' This Regulation shall enter into force on 1 April 1973.This Regulation shall be binding in its entirety and directly applicable in all Member States.
output: ",Regulation amending Regulation (EEC) No 685/69 on detailed rules of application for intervention on the market in butter and cream
