input,output
"input: The following Article 12A shall be added to Regulation (EEC) No 205/73:'Article 12A:1. The Member States shall communicate to the Commission on the 5th and 20th day of each month for the preceding fortnight the quantities of oil seeds and oil-cake for which export licences have been issued, for which the refund has not been fixed in advance, as referred to in Article 1 of Regulation (EEC) No 1986/73.If the quantities for which the export licences have been requested in a Member State do not seem to it to correspond to a normal trade flow, the Member State shall inform the Commission immediately, indicating on the one hand the quantities for which the licences have been requested but not yet issued and on the other hand those for which the licences have been issued during the current fortnight.2. For the purposes of this Article:(a) 'the fortnight preceding the 5th of each month' means the period from the 16th to the end of the month preceding the date specified;(b) 'the fortnight preceding the 20th of each month' means the period from the 1st to the 15th of that month.' This Regulation shall enter into force on the day following its publication in the Official Journal of the European Communities.This Regulation shall be binding in its entirety and directly applicable in all Member States.
output: ",Regulation supplementing Regulation (EEC) No 205/73 on communications between Member States and the Commission concerning oils and fats
"input: The second paragraph of Article 24 of Regulation (EEC) No 685/69 is replaced by the following:'2. Such aid may be paid in the form of payments on account. Until storage has lasted for four months no such payment may be made unless the Member State concerned first obtains appropriate guarantees from the storer.In no case may the amount of any payment exceed the amount as calculated in accordance with paragraph 1 due on the date of such payment.' In Article 26 (2) (a) of Regulation (EEC) No 685/69, the expression 'Article 24 (a) and (b)' is replaced by the expression 'Article 24 (1) (a), (b) and (c)'.In Article 26 (2) (b) of Regulation (EEC) No 685/69, the expression 'Article 24 (c)' is replaced by the expression 'Article 24 (1) (d)'. This Regulation shall enter into force on the day following that of its Publication in the Official Journal of the European Communities.This Regulation shall be binding in its entirety and directly applicable in all Member States.
output: ",Regulation amending Regulation (EEC) No 685/69 on detailed rules of application for intervention on the market in butter and cream
"input: 1. Each Member State shall appoint one or more agencies to be responsible for the control of quality wines psr circulating in its territory and shall inform the other Member States and the Commission of the name of such agency or agencies.2. The duly authorized servants or agents of the agencies referred to in paragraph 1:    - shall have a right of access to all vehicles, or cellars, warehouses or other trade premises, of any person holding with view of sale, putting into circulation for commercial purposes, or transporting, any quality wine psr;- may ask to be shown the accounts or other documents and to be supplied with all information required for control purposes;- may make stock counts and take samples of any quality wine psr held, offered for sale or being transported.3. Member States shall take such measures as may be necessary for the purpose of implementing this Article. 1. The accompanying document drawn up in respect of any quality wine psr pursuant to Commission Regulation (EEC) No 1769/72 (5) of 26 July 1972 drawing up accompanying documents and determining the obligations of wine producers and traders other than retailers, as last amended by Regulation (EEC) No 930/73 (6), shall contain the name of the wine concerned.2. Where, pursuant to Article 13 (2) or (4) of Regulation (EEC) No 1769/72, no accompanying document is required, the name of the quality wine psr concerned shall be indicated in the relevant commercial documents.3. Subject to proof of the contrary, indication in the documents referred to in paragraphs 1 and 2 of the name of the specified region concerned shall be treated as sufficient evidence that a wine is a quality wine psr.  (1)OJ No L 99, 5.5.1970, p. 1. (2)OJ No L 289, 27.12.1972, p. 1. (3)OJ No L 99, 5.5.1970, p. 20. (4)OJ No L 229, 17.8.1973, p. 26. (5)OJ No L 191, 21.8.1972, p. 1. (6)OJ No L 90, 6.4.1973, p. 23. 1. Each Member State shall, before 15 August 1973, communicate to the Commission and to the other Member States the names of the quality wines psr currently produced in its territory at the date of the entry into force of this Regulation, together with the terms of the laws, regulations and administrative provisions governing each such wine.Each Member State shall forthwith communicate to the Commission and to the other Member States:    - the names of any quality wines produced in its territory recognized after the entry into force of this Regulation, together with the terms of the laws, regulations and administrative provisions governing each such wine;- any amendments to the provisions referred to in the first subparagraph hereof or to those referred to in the preceding indent.2. The Commission shall have published in the Official Journal of the European Communities the names of the quality wines psr communicated to it pursuant to paragraph 1. Commission Regulation (EEC) No 1311/73 of 16 May 1973 on a provisional list of quality wines produced in specified regions and on the identification of such wines in the accompanying documents is repealed with effect from 31 August 1973. This Regulation shall enter into force on the third day following its publication in the Official Journal of the European Communities. It shall apply with effect from 1. September 1973, with the exception of Article 3, which shall take effect on the date of the said entry into force.This Regulation shall be binding in its entirety and directly applicable in all Member States.
output: ",Regulation on the control of quality wines produced in specified regions
"input: This Regulation prescribes the detailed rules for applying the system of preferences provided for in Article 6 of Annex I to the Agreement for the following products originating in the Arab Republic of Egypt:ex 08.02 A : Fresh orangesex 08.02 B : Mandarins and satsumas, fresh ; clementines, tangerines, and other similar citrus hybrids, freshex 08.02 C : Fresh lemons. 1. In order that the conditions referred to in Article 6 (2) of Annex I to the Agreement be met, the prices on representative Community markets recorded at, or converted to, the import/wholesale stage taking into account conversion factors and deducting import charges other than customs duties - the factors and charges aforesaid being those used in calculating the entry price referred to in Council Regulation (EEC) No 1035/72 - must, for a given product, be those calculated in due course for Class I pursuant to the first indent, second subparagraph of Article 24 (2) of Council Regulation (EEC) No 1035/72 and be equal to or higher than the price defined in Article 3.2. The Commission shall calculate the amount to be deducted in respect of import charges other than customs duties, in so far as prices notified to the Commission by Member States include these charges, so as to avoid any difficulties arising from the effect of these charges on entry prices which may vary according to origin. Accordingly, an average mean corresponding to the arithmetical mean between the lowest and the highest charges shall be taken into account for the calculation.The detailed rules for applying this paragraph shall be determined, as may be necessary, in accordance with the procedure laid down in Article 33 of Council Regulation (EEC) No 1035/72.3. The representative Community markets within the meaning of paragraph 1, are those used for recording the prices on the basis of which the entry price referred to in Council Regulation (EEC) No 1035/72 is calculated. The price referred to in Article 2 (1) shall be equal to the reference price in force for that period plus the  (1)OJ No L 118, 20.5.1972, p. 1. (2)OJ No L 291, 25.12.1972, p. 147.Common Customs Tariff charge thereon and a fixed charge of 120 units of account per 100 kg. Where the prices reffered to in Article 2 (1) in respect of one of the products listed in Article 1, after taking into account the conversion factors and deducting import charges other than customs duties, remain lower on the lowest priced representative Community markets than the price laid down in Article 3 for three consecutive market days, the Common Customs Tariff duty in force at the date of importation shall apply to that product.This arrangement shall continue to apply until these prices on the lowest priced representative Community markets are found to be for three consecutive market days equal to or higher than the price laid down in Article 3. The Commission, on the basis of prices recorded on representative Community markets and notified by Member States, shall follow price trends regularly and record them in accordance with Article 4.The measures required for this purpose shall be adopted in accordance with the procedure laid down in Council Regulation (EEC) No 1035/72 for applying compensatory charges to fruit and vegetables. Articles 23, 24, 25, 26, 27 and 28 of Council Regulation (EEC) No 1035/72 shall remain in force. This Regulation shall enter into force on the third day following its publication in the Official Journal of the European Communities.It shall apply from the date of the entry into force of the Agreement until such time as the Agreement shall cease to have effect.This Regulation shall be binding in its entirety and directly applicable in all Member States.
output: ",Regulation on imports of citrus fruits originating in the Arab Republic of Egypt
"input: ANNEX IV TO REGULATION ( EEC ) NO 1579/70 IS AMENDED AS FOLLOWS :1 . THE TERM ' UNITS OF ACCOUNT ' IS REPLACED BY THE TERM ' PESETAS ' ;2 . FOOTNOTE 3 IS REPLACED BY THE FOLLOWING :' ( 3 ) THE PRICES MUST NOT BE LESS THAN :- 10 030 PESETAS PER 100 KG NET WEIGHT FOR EMMENTALER AND GRUYERE WHOLE CHEESES FALLING WITHIN SUBHEADING 04.04 A I ( A ) 1 OF THE SPANISH CUSTOMS TARIFF ;- 11 000 PESETAS PER 100 KG NET WEIGHT FOR EMMENTALER AND GRUYERE IN VACUUM-PACKED PIECES OF A WEIGHT EXCEEDING 1 KG FALLING WITHIN SUBHEADING 04.04 A I ( B ) 1 OF THE SPANISH CUSTOMS TARIFF ;- 11 640 PESETAS PER 100 KG NET WEIGHT FOR EMMENTALER AND GRUYERE CHEESES IN VACUUM-PACKED PIECES OF A WEIGHT NOT EXCEEDING 1 KG BUT EXCEEDING 75 G FALLING WITHIN SUBHEADING 04.04 A 1 ( C ) 1 OF THE SPANISH CUSTOMS TARIFF ;- 9 847 PESETAS PER 100 KG NET WEIGHT FOR CHEESES PROCESSED FROM EMMENTALER OR GRUYERE FALLING WITHIN SUBHEADING 04.04 D 1 ( A ) AND 04.04 D 1 ( B ) OF THE SPANISH CUSTOMS TARIFF ;- 10 045 PESETAS PER 100 KG NET WEIGHT FOR CHEESES PROCESSED FROM EMMENTALER OR GRUYERE FALLING WITHIN SUBHEADING 04.04 D 1 ( C ) OF THE SPANISH CUSTOMS TARIFF ;- 8 510 PESETAS PER 100 KG NET WEIGHT FOR OTHER PROCESSED CHEESES FALLING WITHIN SUBHEADING 04.04 D 2 ( A ) OF THE SPANISH CUSTOMS TARIFF ;- 8 725 PESTAS PER 100 KG NET WEIGHT FOR OTHER PROCESSED CHEESES FALLING WITHIN SUBHEADING 04.04 D 2 ( B ) OF THE SPANISH CUSTOMS TARIFF ;- 8 935 PESETAS PER 100 KG NET WEIGHT FOR OTHER PROCESSED CHEESES FALLING WITHIN SUBHEADING 04.04 D 2 ( C ) OF THE SPANISH CUSTOMS TARIFF ;- 8 088 PESETAS PER 100 KG NET WEIGHT FOR CHEDDAR CHEESE RIPENED FOR LESS THAN THREE MONTHS FALLING WITHIN SUBHEADING 04.04 G 1 ( B ) 1 OF THE SPANISH CUSTOMS TARIFF ;- 8 845 PESETAS PER 100 KG NET WEIGHT FOR CHEDDAR CHEESE RIPENED FOR THREE OR MORE MONTHS FALLING WITHIN SUBHEADING 04.04 G 1 ( B ) 1 OF THE SPANISH CUSTOMS TARIFF ;- 8 310 PESETAS PER 100 KG NET WEIGHT FOR FIRST QUALITY DUTCH EDAM CHEESE OF A MINIMUM FAT CONTENT BY WEIGHT REFERRED TO DRY MATTER OF 40 % AND RIPENED FROM SEVEN TO EIGHT WEEKS FALLING WITHIN SUBHEADING 04.04 G 1 ( B ) 3 OF THE SPANISH CUSTOMS TARIFF . ' THIS REGULATION SHALL ENTER INTO FORCE ON 1 OCTOBER 1973 .THIS REGULATION SHALL BE BINDING IN ITS ENTIRETY AND DIRECTLY APPLICABLE IN ALL MEMBER STATES .
output: ",Regulation amending Annex IV to Regulation (EEC) No 1579/70 laying down special conditions for the export of certain cheeses to Spain
"input: ANNEX I TO REGULATION ( EEC ) NO 1324/68 IS REPLACED BY THE ANNEX TO THIS REGULATION . ARTICLE 1 OF REGULATION ( EEC ) NO 1611/68 IS REPLACED BY THE FOLLOWING :' ARTICLE 1IN THE DETERMINATION OF THE LOWEST RATE OF REFUND WITHIN THE MEANING OF ARTICLE 8 ( 2 ) AND THE LAST INDENT OF ARTICLE 9 ( 1 ) OF REGULATION NO 1041/67/EEC , THE REFUNDS ON EXPORTS TO SWITZERLAND :- OF THE PROCESSED CHEESES FALLING WITHIN SUBHEADING 04.04 D II OF THE COMMON CUSTOMS TARIFF ,AND- THE CHEESES LISTED IN ANNEX I TO REGULATION ( EEC ) NO 1324/68SHALL NOT BE TAKEN INTO ACCOUNT . ' THIS REGULATION SHALL ENTER INTO FORCE ON THE THIRD DAY FOLLOWING ITS PUBLICATION IN THE OFFICIAL JOURNAL OF THE EUROPEAN COMMUNITIES .THIS REGULATION SHALL BE BINDING IN ITS ENTIRETY AND DIRECTLY APPLICABLE IN ALL MEMBER STATES .
output: ",Regulation amending the special provisions contained in Regulations (EEC) Nos 1324/68 and 1611/68 in respect of export of certain cheeses
"input: THE MAXIMUM TOTAL CONTENT OF SULPHUR DIOXIDE IS 400 MG/L :A . WHITE QUALITY WINES PRODUCED IN SPECIFIED REGIONS :( A ) WINES HAVING THE RIGHT TO THE NAME BEERENAUSLESE ;( B ) WINES HAVING THE RIGHT TO THE NAME TROCKENBEERENAUSLESE ;( C ) SAUTERNE ;( D ) BARSAC .B . IMPORTED WHITE QUALITY WINES :WHITE QUALITY WINES HAVING THE RIGHT TO THE NAME BEERENAUSLESE OR TROCKENBEERENAUSLESE IN CONFORMITY WITH THE COMMUNITY PROVISIONS OR IN THEIR ABSENCE WITH THOSE OF THE MEMBER STATES . IN RESPECT OF WINES OF WHICH THERE IS PROOF THEY WERE PRODUCED BEFORE 1 OCTOBER 1973 , THE PROVISIONS OF ARTICLE 26A OF COUNCIL REGULATION ( EEC ) NO 816/70 :- SHALL NOT APPLY IF THEY ARE MARKETED FOR DIRECT HUMAN CONSUMPTION IN CONTAINERS OF 5 LITRES OR LESS ;- SHALL NOT APPLY ON OR BEFORE 1 JANUARY 1974 IF THEY ARE MARKETED FOR DIRECT HUMAN CONSUMPTION IN CONTAINERS OF MORE THAN 5 LITRES . THIS REGULATION SHALL ENTER INTO FORCE ON THE DAY OF ITS PUBLICATION IN THE OFFICIAL JOURNAL OF THE EUROPEAN COMMUNITIES .IT SHALL APPLY FROM 1 OCTOBER 1973 .THIS REGULATION SHALL BE BINDING IN ITS ENTIRETY AND DIRECTLY APPLICABLE IN ALL MEMBER STATES .
output: ","Regulation determining a list of white quality wines, produced in specified regions and of imported white quality wines containing a certain percentage of sulphur dioxide and laying down certain transitional provisions relating to the percentage of sulphur dioxide in wines produced before 1 October 1973"
"input: Article 3 (2) of Regulation (EEC) No 619/71 is replaced by the following:'2. For flax grown mainly for fibre, half of the aid shall be granted to the grower and the other half to any natural or legal person who has concluded with the grower before a date to be determined a contract by which it obtains property in the straw flax.However, the whole of the aid shall be granted to the grower when:    (a) the said contract has not been concluded before the abovementioned date, or(b) the grower as defined in Article 3 (a) (a) processes the straw flax or has it processed on his own account, or(c) the grower meets the conditions set out in Article 3 (a) (b).' Article 3 (a), as set out below, shall be added to Regulation (EEC) No 619/71:'Article 3 (a)For the purpose of this Regulation, a 'grower' shall mean any natural or legal person who:    (a) produces flax or hemp on his own holding, or(b) has concluded, before sowing, a contract with an owner or farmer for the production of flax grown mainly for fibre, under which the owner or farmer  (1)OJ No L 146, 4.7.1970, p. 1. (2)OJ No L 73, 27.3.1972, p. 14. (3)OJ No L 72, 26.3.1971, p. 2.      - renounces all rights of ownership in the harvest;- receives in return a fixed sum per hectare, determined at the time of concluding the contract.' This Regulation shall enter into force on the day following its publication in the Official Journal of the European Communities.It shall apply from the 1974/75 marketing year.This Regulation shall be binding in its entirety and directly applicable in all Member States.
output: ",Regulation amending Regulation (EEC) No 619/71 laying down general rules for granting aid for flax and hemp
"input: The following shall be substituted for Article 1 (3) of Regulation No 79/65/EEC:'The data obtained pursuant to this Regulation shall, in particular, serve primarily as the basis for the drawing up of reports by the Commission on the situation of agriculture and of agricultural markets as well as on farm incomes in the Community ; the reports are to be submitted annually to the Council and the European Parliament, in particular for the annual fixing of prices of agricultural produce.' The following shall be substituted for Article 4 (1) and (2) of Regulation No 79/65/EEC:'1. The field of survey referred to in Article 1 (2) (a) shall cover those agricultural holdings, which:    - are run as market-oriented holdings,- provide the main occupation of the operator,  (1)OJ No 109, 23.6.1965, p. 1859/65. (2)OJ No L 298, 31.12.1972, p. 47.- ensure the employment, per year, of at least one worker (1 man-work unit) ; this threshold may, however, be reduced in the case of a Member State to 0 775 man-work units in accordance with the procedure laid down in Article 19.2. For the accounting years beginning in the year 1973 and 1974, the number of retaining holdings shall be 13 600. This number shall be increased gradually at the beginning of each of the financial years commencing during the period 1975 to 1978 so as to attain eventually the number of 28 000 returning holdings.' The following shall be substituted for Article 23 of Regulation No 79/65/EEC:'Before 1 January 1980 the Commission shall submit to the Council a full report on the operation of the data network together with any proposal for amending this Regulation, as appropriate.' The list of divisions referred to in Article 2 (d) of Regulation No 79/65/EEC shall be replaced, as regards Italy, by the list annexed hereto. This Regulation shall enter into force on the third day following its publication in the Official Journal of the European Communities.This Regulation shall be binding in its entirety and directly applicable in all Member States.
output: ","Regulation amending Regulation No 79/65/EEC as regards the utilization of accountancy data, the field of survey and the number of returning holdings to be included in the farm accountancy data network of the European Economic Community"
"input: The amount by which the levy is to be reduced in accordance with Article 1 of Regulation (EEC) No 2412/73 shall be fixed at the latest on the tenth day of the month preceding the quarter in which it will be applicable.The reference period referred to in the same Article shall be the quarter preceding the month in which such fixing takes place. Proof that the special export charge has been levied shall be shown by the Egyptian Customs Authorities adding one of the following phrases to the list entitled 'Observations' in the movement-of-goods Certificate A.ET.l:'Taxe spéciale à l exportation appliquéeDen særlige udførselsafgift opkrævetAusfuhrabgabe erhobenSpecial export charge leviedApplicata tassa speciale all esportazioneUitvoerbelasting voldaan'(signature and office stamp).  (1)OJ No 174, 31.7.1967, p. 1. (2)OJ No L 73, 27.3.1972, p. 14. (3)OJ No L 251, 7.9.1973, p. 103. (4)OJ No L 251, 7.9.1973, p. 22. 1. The quantities of rice imported, under Regulation (EEC) No 2412/73, originating and coming from the Arab Republic of Egypt, shall be counted against the annual volume referred to in Article 3 of this Regulation from 1 September each year and for the marketing year 1973/74 from 1 November until 31 August of the following year.2. In cases where the amount by which the levy is to be reduced in accordance with Article 1 is nil, the quantities of rice imported from the Arab Republic of Egypt shall not be counted against the annual volume.3. For the marketing year 1973/74 the annual volume referred to in paragraph 1 shall be reduced to 26 700 metric tons. The Member States shall inform the Commission of the quantities imported under Regulation (EEC) No 2412/73 as soon as possible and not later than the 1st and 15th of each month.The Commission shall notify the Member States each week of the position with regard to imports from the Arab Republic of Egypt. This Regulation shall enter into force on 1 November 1973.This Regulation shall be binding in its entirety and directly applicable in all Member States.
output: ",Regulation on detailed rules for the application of Council Regulation (EEC) No 2412/73 of 24 July 1973 concerning imports of rice from the Arab Republic of Egypt
"input: Member States shall communicate to the Commission, for each species or group of varieties for which an aid has been fixed and for each type of hybrid maize for sowing for which a reference price has been fixed, the information listed in the Annex by the dates specified therein.This Regulation shall be binding in its entirety and directly applicable in all Member States.
output: ",Regulation on the communication of the information necessary for implementing Regulation (EEC) No 2358/71 on the common organization of the market in seeds
