input,output
"input: Annex 3 of the Council Directive of 30 March 1971 on external quality standards for forest reproductive material is amended as follows:    1. In 3.2.1.2 the figure 4 on the second line of the column headed 'Maximum age' for the species Picea abies under 'Stocky young plants' is prepared by the figure 5.2. In 3.2.1.2 the following standards are inserted for the species Pinus nigra (other than Austriaca) concerning stocky young plants: >PIC FILE= 'T0005451'> The Member States shall, not later than 1 July 1974, bring into force the laws, regulations or administrative provisions necessary to comply with this Directive. They shall forthwith inform the Commission thereof. This Directive is addressed to all Member States.
output: ",Commission Directive amending Annex 3 to the Council Directive of 30 March 1971 on external quality standards for forest reproductive material
"input: For the purposes of this Directive, 'vehicle' means any motor vehicle intended for use on the road, with or without bodywork, having at least four wheels and a maximum design speed exceeding 25 km/h, with the exception of vehicles which run on rails, agricultural tractors and machinery and engineering plant. No Member State may refuse to grant EEC type approval or national type approval of a vehicle on grounds relating to the device to prevent unauthorized use if such device meets the requirements set out in Annex I. No Member State may refuse or prohibit the sale, registration, entry into service or use of any vehicle on grounds relating to the device to prevent unauthorized use if such device meets the requirements set out in Annex I. The Member State which has granted type approval shall take the necessary measures to be informed of any modification of a part or characteristic referred to in item 2.2. of Annex I. The competent authorities of that State shall determine whether fresh tests should be carried out on the modified vehicle and a fresh report drawn up. Where such tests reveal failure to comply with the requirements of this Directive, the modification shall not be approved.  (1)OJ No C 112, 27.10.1972, p. 16. (2)OJ No C 60, 26.7.1973, p. 12. (3)OJ No L 42, 23.2.1970, p. 1. (4)EEC, Geneva, E/ECE/324 - E/ECE/TRANS/505/Rev. Add. 17. The amendments necessary for- adjusting the requirements of Annexes I and II so as to take account of technical progress shall be adopted in accordance with the procedure laid down in Article 13 of the Council Directive of 6 February 1970 on the harmonization of the laws of the Member States relating to the type-approval of motor vehicles and their trailers. 1. Member States shall put into force the provisions needed in order to comply with this Directive within eighteen months of its notification and shall forthwith inform the Commission thereof.2. Member States shall ensure that the texts of the main provisions of national law which they adopt in the field covered by this Directive are communicated to the Commission. This Directive is addressed to the Member States.
output: ",Council Directive on the approximation of the laws of the Member States relating to devices to prevent the unauthorized use of motor vehicles
"input: 1. This Directive deals with the laying down of maximum permitted levels for undesirable substances and products in feedingstuffs, as listed in the Annex.2. This Directive shall apply without prejudice to the provisions on:    (a) additives in feedingstuffs;(b) the marketing of feedingstuffs;(c) the fixing of maximum permitted levels of pesticide residues on and in products intended for animal feeding. For the purposes of this Directive the following definitions shall apply:    (a) Feedingstuffs : organic or inorganic substances, used singly or in mixtures, whether or not containing additives, for oral animal feeding;(b) Straight feedingstuffs : various vegetable and animal products in their natural state, fresh or preserved, and their derivatives after industrial processing, as well as the various organic and inorganic substances intended as such for oral animal feeding;(c) Daily ration : the average total quantity of feedingstuffs, calculated on a moisture content of 12 %, required daily by an animal of a given species, age category and yield, to satisfy all its needs;(d) Complete feedingstuffs : mixtures of feedingstuffs which, by reason of their composition, are sufficient for a daily ration;(e) Complementary feedingstuffs : mixtures of feedingstuffs which have a high content of certain substances and which, by reason of their composition, are sufficient for a daily ration only if they are used in combination with other feedingstuffs. 1. Member States shall prescribe that the substances and products listed in the Annex shall be tolerated in feedingstuffs only under the conditions therein set out.2. Member States may allow the maximum levels provided for in the Annex in respect of feedingstuffs to be exceeded:    - where the feedingstuffs are intended to be sent for delivery to recognized manufactures only and, after mixing, meet the provisions set out in the Annex;- and where any other use is shown to be excluded by any appropriate indication. Member States shall prescribe that in so far as there are no special provisions for complementary feedingstuffs, these may not - allowing for the dilutions prescribed for their use - contain levels of the substances and products listed in this Directive in excess of those fixed for complete feedingstuffs. 1. Where a Member State considers that a maximum content fixed in the Annex, or that a substance or product not listed therein, presents a danger to animal or human health, that Member State may provisionally reduce this content, fix a maximum content, or forbid the presence of that substance or product in feedingstuffs it shall advise the other Member States and the Commission without delay of the measures taken and at the same time give its reasons.2. In accordance with the procedure laid down in Article 10, an immediate decision shall be made as to whether the Annex should be modified. So long as no decision has been made by either the Council or the Commission the Member State may maintain the measures it has implemented. Amendments to be made to the Annex due to developments in scientific or technical knowledge shall be adopted in accordance with the procedure laid down in Article 9. Member States shall ensure that feedingstuffs which conform to this Directive are not subject to any other  (1)OJ No L 170, 3.8.1970, p. 1.marketing restrictions as regards the presence of undesirable substances and products. 1. Member States shall take all necessary measures to ensure that feedingstuffs are officially controlled, at least by random sampling, to verify whether the conditions laid down in this Directive are satisfied.2. Member States shall inform the other Member States and the Commission of the name of the departments appointed to carry out this control. 1. Where the procedure laid down in this Article is to be followed matters shall be referred without delay by the Chairman, either on his own initiative or at the request of a Member State, to the Standing Committee for Feedingstuffs, hereinafter called the 'Committee'.2. The votes of the Member States within the Committee shall be weighted as provided in Article 148 (2) of the Treaty. The Chairman shall not vote.3. The representative of the Commission shall submit a draft of the measures to be adopted. The Committee shall deliver its Opinion on such measures within a time limit set by the Chairman according to the urgency of the matters. Opinions shall be delivered by a majority of 41 votes.4. The Commission shall adopt the measures and implement them forthwith where they are in accordance with the Opinion of the Committee. Where they are not in accordance with the Opinion of the Committee, or if no Opinion is delivered, the Commission shall without delay propose to the Council the measures to be adopted. The Council shall adopt the measures by a qualified majority.If the Council has not adopted any measures within three months of the proposal being submitted to it, the Commission shall adopt the proposed measures and implement them forthwith, except where the Council has voted by a simple majority against such measures. 01. Where the procedure laid down in this Article is to be followed, matters shall be referred to the Committee without delay by the Chairman, either on his own initiative or at the request of a Member State.2. The votes of the Member States within the Committee shall be weighted as provided in Article 148 (2) of the Treaty. The Chairman shall not vote.3. The representative of the Commission shall submit a draft of the measures to be adopted. The Committee shall deliver its Opinion on such measures within two days. Opinions shall be delivered by a majority of 41 votes.4. The Commission shall adopt the measures and implement them forthwith where they are in accordance with the Opinion of the Committee. Where they are not in accordance with the Opinion of the Committee, or if no Opinion is delivered, the Commission shall without delay propose to the Council the measures to be adopted. The Council shall adopt the measures by a qualified majority.If the Council has not adopted any measures within 15 days of the proposal being submitted to it, the Commission shall adopt the proposed measures and implement them forthwith, except where the Council has voted by a simple majority against such measures. 1Member States shall retain the right to waive the provisions of this directive as regards feedingstuffs intended to be exported to third countries. 2The Member States shall bring into force, on 1 January 1976, the laws, regulations and administrative provisions necessary to comply with this Directive and shall forthwith inform the Commission thereof. 3This Directive is addressed to the Member States.
output: ",Council Directive on the fixing of maximum permitted levels for undesirable substances and products in feedingstuffs
"input: Annexes II and IX of Council Directive No 71/320/EEC of 26 July 1971 are modified according to the Annex to the present Directive. 1. With effect from 1 October 1974 no Member State shall on grounds relating to the braking devices:  (1)OJ No L 42, 23.2.1970, p. 1. (2)OJ No L 73, 27.3.1972, pp. 115 and 157. (3)OJ No L 202, 6.9.1971, p. 37. (4)OJ No L 73, 27.3.1972, pp. 118, 119 and 158.     - refuse EEC type approval, the delivery of the document referred to in Article 10 (1), last subsection, of Council Directive No 70/156/EEC of 6 February 1970, or the national type approval of a type of motor vehicle;- nor prohibit the entry into service of the vehicles ; if the braking devices of this type of vehicle or of these vehicles comply with the provisions of Council Directive No 71/320/EEC of 26 July 1971, as last amended by this Directive.2. From 1 January 1975 onwards a Member State:    - shall no longer deliver the document envisaged in Article 10 (1), last subsection, of Council Directive No 70/156/EEC of 6 February 1970, for a type of vehicle of which the braking devices do not comply with the provision of Council Directive No 71/320/EEC of 26 July 1971, as last amended by this Directive;- may refuse the national type approval of a type of vehicle of which the braking devices do not comply with the provisions of Council Directive No 71/320/EEC of 26 July 1971, as last amended by this Directive.3. With effect from 1 October 1975 a Member State may prohibit the entry into service of vehicles of which the braking devices do not comply with the provisions of Council Directive No 71/320/EEC of 26 July 1971, as last amended by this Directive.4. The Member States shall adopt and publish the provision necessary in order to comply with this Directive before 1 June 1974 and shall forthwith inform the Commission thereof. This Directive is addressed to the Member States.
output: ",Commission Directive adapting to technical progress the Council Directive of 26 July 1971 on the approximation of the laws of the Member States relating to the braking devices of certain categories of motor vehicles and of their trailers
"input: This Directive concerns weights of above-medium accuracy the nominal value of which is equal to 1 mg or more and less than or equal to 50 kg.This Directive does not apply to metric carat weights or to special weights covered by other directives. Weights which may receive the EEC marks and signs are listed in the Annex. They are not subject to EEC pattern approval; they must undergo EEC initial verification. No Member State may prevent, prohibit or restrict the placing on the market or entry into service of weights referred to in Article 1 and bearing the EEC initial verification mark. 1.xa0xa0xa0Member States shall put into force the laws, regulations and administrative provisions needed in order to comply with this Directive within eighteen months of its notification and shall forthwith inform the Commission thereof.2.xa0xa0xa0Member States shall ensure that the texts of the main provisions of national law which they adopt in the field covered by this Directive are communicated to the Commission. This Directive is addressed to the Member States.
output: ",Council Directive on the approximation of the laws of the Member States relating to weights of from 1 mg to 50 kg of above-medium accuracy
"input: The title of the Directive of 23 July 1962 is replaced by the following:'First Council Directive on the establishment of common rules for certain types of carriage of goods by road between Member States.' The following subparagraph is added to Article 1 (1) of the Council Directive of 23 July 1962:'Each Member State shall, in the manner laid down in paragraphs 2 and 3 of this Article, liberalize the types of international carriage of goods by road on own account involving other Member States listed in Annexes I and II to this Directive, where such carriage is performed to or from the territory of that Member State or passing in transit across the territory of that Member State.' The following points are added to Annex I to the Directive of 23 July 1962:'10. Carriage of goods in motor vehicles the permissible laden weight of which, including that of trailers, does not exceed 6 metric tons or the permissible payload of which, including that of trailers, does not exceed 3.5 metric tons.11. Carriage of articles required for medical care in emergency relief, in particular for natural disasters.12. Carriage of valuable goods (for example, precious metals) effected by special vehicles accompanied by the police or other security guards.' Annex II to the Council Directive of 23 July 1962 is amended as follows:    (a) the first sentence of point 1 is replaced by the following:'Carriage from a Member State into the frontier zone of an adjacent Member State, extending to a depth of 25 kilometres as the crow flies from their common frontier, and vice versa.'  (1)OJ No 70, 6.8.1962, p. 2005/62. (2)OJ No L 291, 28.12.1972, p. 155.(b) point 2 is deleted, and points 3, 4, 5 and 6 are renumbered 2, 3, 4 and 5 respectively,(c) the following points are added:'6. Carriage of spare parts for sea-going vessels.7. Carriage of live animals with the exception of cattle for slaughter and thoroughbred horses.' Member States shall take the necessary steps to liberalize, by 1 July 1974 at the latest, the types of transport referred to in Articles 2 and 3 and Article 4 (a) and (c) of this Directive.Each Member State shall, within three months of notification of this Directive and in any event before 1 July 1974, inform the Commission of the measures taken to implement this Directive. This Directive is addressed to the Member States.
output: ",Council Directive amending the first Directive on the establishment of certain common rules for international transport (carriage of goods by road for hire or reward)
"input: 1. 'Agricultural or forestry tractor' means any motor vehicle, fitted with wheels or caterpillar tracks and having at least two axles, the main function of which lies in its tractive power and which is specially designed to tow, push, carry or power certain tools, machinery or trailers intended for agricultural or forestry use. It may be equipped to carry a load and passengers.2. This Directive shall apply only to tractors defined in the preceding paragraph which are fitted with pneumatic tyres and which have two axles and a maximum design speed of between 6 and 25 km/h. No Member State may refuse to grant EEC type-approval or national type-approval of a tractor on grounds relating to:    - the maximum permissible laden weight,- the location and fitting of the rear registration plates,- fuel tanks,- ballast weights,- audible warning devices,- the permissible sound level and exhaust system (silencer),is these satisfy the requirements set out in the relevant Annexes. No Member State may refuse the registration or prohibit the sale, entry into service or use of tractors on grounds relating to the parts and characteristics listed in Article 2 if these satisfy the requirements set out in the relevant Annexes. The amendments necessary for adapting to technical progress the requirements of the Annexes, apart from those set out at points I.1 and I.4.1.2 of Annex VI,   (1)OJ No 28, 17.2.1967, p. 462/67. (2)OJ No 42, 7.3.1967, p. 620/67. (3)See p. 10 of this Official Journal.shall be adopted in accordance with the procedure laid down in Article 13 of the Council Directive on the type-approval of wheeled agricultural or forestry tractors. 1. Member States shall put into force the provisions necessary in order to comply with this Directive within eighteen months of its notification and shall forthwith inform the Commission thereof.2. Member States shall ensure that the texts of the main provisions of national law which they adopt in the field covered by this Directive are communicated to the Commission. This Directive is addressed to the Member States.
output: ",Council Directive on the approximation of the laws of the Member States relating to certain parts and characteristics of wheeled agricultural or forestry tractors
"input: 1. 'Agricultural or forestry tractor' means any motor vehicle, fitted with wheels or caterpillar tracks and having at least two axles, the main function of which lies in its tractive power and which is specially designed to tow, push, carry or power certain tools, machinery or trailers intended for agricultural or forestry use. It may be equipped to carry a load and passengers.2. This Directive shall apply only to tractors defined in the preceding paragraph which are fitted with pneumatic tyres and which have two axles and a maximum design speed of between 6 and 25 km/h. No Member State may refuse to grant EEC type-approval or national type-approval of a tractor on grounds relating to the maximum design speed or the load platforms if these satisfy the requirements set out in the Annex. No Member State may refuse the registration or prohibit the sale, entry into service, or use of tractors on grounds relating to the maximum design speed or the load platforms if these satisfy the requirements set out in the Annex. 1. No Member State may prohibit the fitting of load platforms or require that tractors must be fitted with one or more such platforms.2. No Member State may prohibit the carriage on such platforms of products which they permit to be carried on trailers used for agriculture or forestry purposes ; within the limits laid down by the manufacturer, a maximum load of at least 80 % of the weight of the tractor in running order is authorized. The amendments necessary for adopting to technical progress the requirements of the Annex shall  (1)OJ No 28, 17.2.1967, p. 462/67. (2)OJ No 42, 7.3.1967, p. 620/67. (3)See p. 10 of this Official Journal.be adopted in accordance with the procedure laid down in Article 13 of the Council Directive on the type-approval of wheeled agricultural or forestry tractors. 1. Member States shall put into force the provisions necessary in order to comply with this Directive within eighteen months of its notification and shall forthwith inform the Commission thereof.2. Member States shall ensure that the texts of the main provisions of national law which they adopt in the field covered by this Directive are communicated to the Commission. This Directive is addressed to the Member States.
output: ",Council Directive on the approximation of the laws of the Member States relating to the maximum design speed of and load platforms for wheeled agricultural or forestry tractors
"input: Member States shall issue on request the official certificate provided for in Article 11 of the Directive on the marketing of fodder plant seed,    (a) in the case of seeds of a size not less than that of a grain of wheat, if a sample of at least 500 g, drawn in accordance with the provisions of Article 7 of the abovementioned Directive, is free of Avena fatua at the time of official examination;(b) in the case of seeds of a size smaller than a grain of wheat,       - if the crop is free of Avena fatua at the time of field inspection officially carried out in conformity with the provisions of Annex I to the abovementioned Directive and if a sample of at least 100 g, drawn in accordance with the provisions of Article 7 of the abovementioned Directive, is free of Avena fatua at the time of official examination, or- if a sample of at least 300 g, drawn in accordance with the provisions of Article 7 of the abovementioned Directive, is free of Avena fatua at the time of official examination. 1. Member States shall issue the official certificate provided for in Article 11 of the Directive on the marketing of cereal seed,    - if the crop is free of Avena fatua at the time of field inspection officially carried out in conformity with the provisions of Annex 1 of the abovementioned Directive and if a sample of a least 1 kg, drawn in accordance with the provisions of Article 7 of the abovementioned Directive is free of Avena fatua at the time of official examination, or- if a sample of at least 3 kg, drawn in accordance with the provisions of Article 7 of the abovementioned Directive, is free of Avena fatua at the time of official examination. Member States may prescribe that the official certificate is issued only in one of the two cases provided for in Article 1 (b) and Article 2 respectively. Member States shall bring into force, not later than 1 July 1974, the laws, regulations or administrative provisions necessary to comply with this Directive. They shall forthwith inform the Commission, who shall inform the other Member States, thereof. This Directive is addressed to the Member States.
output: ",Commission Directive laying down special conditions concerning the presence of 'Avena fatua' in fodder plant and cereal seed
"input: In Article 7 (1) of Directive No 72/464/EEC, the terms 'period of 24 months' shall be replaced by 'period of 36 months'. This Directive is addressed to the Member States.
output: ",Council Directive amending Directive No 72/464/EEC on taxes other than turnover taxes which affect the consumption of manufactured tobacco
"input: 1. 'Agricultural or forestry tractor' means any motor vehicle, fitted with wheels or caterpillar tracks and having at least two axles, the main function of which lies in its tractive power and which is specially designed to tow, push, carry or power certain tools, machinery or trailers intended for agricultural or forestry use. It may be equipped to carry a load and passengers.2. This Directive shall apply only to tractors defined in the preceding paragraph which are fitted with pneumatic tyres and which have two axles and a maximum design speed of between 6 and 25 km/h. No Member State may refuse to grant EEC type-approval or national type-approval of a tractor on grounds relating to rear-view mirrors if these satisfy the requirements set out in the Annex.  (1)OJ No 28, 17.2.1967, p. 462/67. (2)OJ No 42, 7.3.1967, p. 620/67. (3)OJ No L 84, 28.3.1974, p. 10. No Member State may refuse the registration or prohibit the sale, entry into service or use of tractors on grounds relating to rear-view mirrors if these satisfy the requirements set out in the Annex. The amendments necessary for adapting to technical progress the requirements of the Annex shall be adopted in accordance with the procedure laid down in Article 13 of Council Directive No 74/150/EEC. 1. Member States shall put into force the provisions necessary in order to comply with this Directive within 18 months of its notification and shall forthwith inform the Commission thereof.2. Member States shall ensure that the texts of the main provisions of national law which they adopt in the field covered by this Directive are communicated to the Commission. This Directive is addressed to the Member States.
output: ",Council Directive on the approximation of the laws of the Member States relating to rear-view mirrors for wheeled agricultural or forestry tractors
