input,output
"input: story: Sal was a grumpy person. He had no friends and hated almost everything. He went to town to pick up gifts. They were for himself because he like almost no one. Later that night he cried himself to sleep.
 selected sentence: They were for himself because he like almost no one.
output: ",Sal doesn't have friends >Causes/Enables> Sal buys gifts for himself
"input: story: Ted was walking on an icy sidewalk. He was wearing the wrong kind of shoes. He would slip and try to catch himself on the ice. It took him 50 minutes to walk 50 feet. Ted never leaves home without his snow boots now.
 selected sentence: Ted was walking on an icy sidewalk.
output: ",Tim goes to the location of the sidewalk >Causes/Enables> Tim walks on the icy sidewalk
"input: story: Tom ate a lot and got fatter and fatter. I asked him why he ate so much. He said it was because his wife, Mary, kept buying food. I asked Mary why she bought so much food. She said it was because Tom kept eating the food.
 selected sentence: Tom ate a lot and got fatter and fatter.
output: ",Mary bought a lot of food >Causes/Enables> Tom ate a lot of food
"input: story: Jen wanted to ride her bike. She put on her biking shoes. She put on her biking outfit. She knew she was forgetting Something! She remembered to helmet so she could be safe!
 selected sentence: She remembered to helmet so she could be safe!
output: ",Jen forgets Something while getting ready to ride her bike >Causes/Enables> Jen remembers her helmet
"input: story: Todd had an important meeting in the morning. He set his alarm and went to sleep early. The next morning, he woke up passed his alarm. It turned out that his power went out and his alarm shut off. He called his boss and sadly went to work late.
 selected sentence: The next morning, he woke up passed his alarm.
output: ",Todd sets his alarm and sleeps early >Causes/Enables> Todd wakes up past his alarm
"input: story: Chris loved the NFL. He always wanted to go to a game. So one evening his dad tells him he's gonna be taking him to a game. Chris gets so excited and jumps up and down. Chris and his dad go to the game and have a great time.
 selected sentence: Chris gets so excited and jumps up and down.
output: ",Chris gets excited >Causes/Enables> Chris jumps up and down
"input: story: Yesterday I went on a trip to animal kingdom. It was very fun. I loved going and seeing the animals. I took many pictures. When I left I couldn't wait to go back.
 selected sentence: When I left I couldn't wait to go back.
output: ",I leave >Causes/Enables> I can't wait to go back
"input: story: Aaron was running late for a date. So he was driving 60 in a 30. Instantly he was pulled over by a cop. Aaron always knew flirting with cops could get out of tickets. He now has a date with the backseat of a cop car.
 selected sentence: So he was driving 60 in a 30.
output: ",Aaron was running late >Causes/Enables> Aaron speeds
"input: story: Manuel was a young boy in third grade. He was very close to his father because his mother was gone. That year his father got very sick and passed away. Manuel was very sad and had a hard time with it. He went to live with his sister until he turned 18.
 selected sentence: Manuel was very sad and had a hard time with it.
output: ",Manuel's father gets very sick and passes away >Causes/Enables> Manuel is very sad and has a hard time with it
"input: story: Lily came home from work. When she walked in the house she smelled Something good. It was freshly baked cookies. Lily was so happy. She went in the kitchen and ate many of them.
 selected sentence: When she walked in the house she smelled Something good.
output: ",Lily comes home >Causes/Enables> Lily enters the house
"input: story: Ray was forced to go back to his hometown. Ray thought the trip would be boring. When he got there he was surprised at what he saw. Memories flooded back into his mind of his childhood. Ray had the best weekend of his life!
 selected sentence: Ray thought the trip would be boring.
output: ",Ray is forced to go to his hometown >Causes/Enables> He thinks the trip will be boring
"input: story: Molly and Devin love going on long walks. Last week they decided to go on a walk together. During their walk they saw a lot of squirrels. They went home to tell their friends about all the squirrels they saw. Molly and Devin had a great time out on their walk.
 selected sentence: They went home to tell their friends about all the squirrels they saw.
output: ",Molly and Devin see squirrels >Causes/Enables> Molly and Devin tell their friends about the squirrels
"input: story: Ira went to the store to buy Something to eat. Chips were on sale so he bought a bag. Ira counted the chips as he ate them. The last whole chip in the bag was number 63. Ira ate the small crumbs and counted them as chip number 64.
 selected sentence: Ira counted the chips as he ate them.
output: ",Ira buys a bag of chips >Causes/Enables> Ira counts the chips as he eats them
"input: story: Michael was scared of dust. One day he came home from a long day at work. He sat down on his couch that was dirty. Dust flew up everywhere. Michael got a panic attack.
 selected sentence: One day he came home from a long day at work.
output: ",Michael leaves work >Causes/Enables> He comes home from work
"input: story: Cassidy was riding her bike. She was going down her driveway when she hit a rock. The bike flipped and she fell on the ground. Her mom rushed out to check on her. It turned out that her arm was broken.
 selected sentence: Her mom rushed out to check on her.
output: ",Cassidy flipped on her bike >Causes/Enables> Cassidy's mom rushed out to check on her
"input: story: Tim saw the little girl fall on the sidewalk. He ran up to where she had fallen. He saw that she was crying. Tim reached out and pulled her back up. The little girl started to stop crying as Tim smiled at her.
 selected sentence: Tim reached out and pulled her back up.
output: ",Tim runs toward the little girl >Causes/Enables> Tim pulls her back up
"input: story: My dog needed a new bed. He had torn his into pieces. I decided to go ahead and buy him a new one. When I got home, he had torn up the new one. I decided to give him a blanket from now on.
 selected sentence: I decided to give him a blanket from now on.
output: ",My dog tears up its bed >Causes/Enables> I give the dog a blanket
"input: story: Adam took a walk He then saw a kid by himself. He wasn't sure what to do. Then the kids father shows up. Adam carries on
 selected sentence: Adam carries on
output: ",Adam decides to carry on >Causes/Enables> Adam carries on 
"input: story: My dad and I like to hunt for worms. We use the worms for fishing. Tonight was the perfect night for hunting for worms. Tonight I got the most worms ever. My dad and I decided to sell some worms and use the rest for fishing.
 selected sentence: Tonight I got the most worms ever.
output: ",I hunt for worms >Causes/Enables> I get worms
"input: story: Sally was riding her bike. She was only on her bike for a few minutes before she got a flat tire. She quickly patched up her bike with some tape. She was able to swap out a new tire when she went back to her car. Sally was able to complete her morning bike ride.
 selected sentence: Sally was riding her bike.
output: ",Sally gets her bike >Causes/Enables> Sally rides her bike
"input: story: Felix wanted to go to disney world. One day he won two tickets for entry. He invited his friend Alissa. Alissa hated disney. He ended up going alone.
 selected sentence: He invited his friend Alissa.
output: ",Felix wins two tickets >Causes/Enables> Felix invites Alissa
"input: story: Jonah's son had been playing with his building blocks. His son had left the blocks all over the room. Jonah stepped on a block. It hurt his foot. Jonah threw all the blocks away.
 selected sentence: Jonah's son had been playing with his building blocks.
output: ",Jonah's son gets building blocks >Causes/Enables> Jonah's son plays with building blocks
"input: story: Larry wanted an apple for lunch. He went to the store to buy it. He bought it. He brought it home. He ate the apple for lunch.
 selected sentence: He brought it home.
output: ",Larry buys an apple >Causes/Enables> Larry brings home the apple
"input: story: Matt threw a party. It was a lot of fun for Matt. He loved being with his friends and having a good time. The only problem is that it made his house messy. He had to clean up the place by himself, so he was upset.
 selected sentence: He had to clean up the place by himself, so he was upset.
output: ",Matt throws a party at his house >Causes/Enables> Matt cleans up his house
"input: story: There was a girl who had very long hair. It was black and soft. But her hair always got everywhere. One day I found one of her hairs in my soup. It was very long and got down my throat.
 selected sentence: But her hair always got everywhere.
output: ",The girl's hair falls out >Causes/Enables> The girl's hair gets everywhere
"input: story: Tom was walking around outside. He saw a straw cat. He decided to pet it. The cat bit him. He got very nervous and went to the doctors.
 selected sentence: Tom was walking around outside.
output: ",Tom was walking around outside >Causes/Enables> he saw a cat
"input: story: My friend, Nate, and I went to his parents house. He wanted to show me that he was good at soccer. He took a ball from his basement and started juggling it. He missed the ball once, slipped, and fell on the ground. We still make fun of him to this day.
 selected sentence: We still make fun of him to this day.
output: ",Nate misses while juggling >Causes/Enables> We make fun of him
"input: story: Last night I planned to make hamburgers. I got the meat out ready to cook them. However when I looked for the buns I found Something. The buns were moldy and green. I immediately had to throw them out.
 selected sentence: However when I looked for the buns I found Something.
output: ",I make hamburgers >Causes/Enables> I find Something on the buns
"input: story: The dog scratched itself. Its hair flew everywhere. The house was covered in it. Chuck vacumned again. The dog stayed downstairs.
 selected sentence: Its hair flew everywhere.
output: ",The dog scratches itself >Causes/Enables> Hairs fly everywhere
"input: story: Kim just got a new dog. She wanted to take it walking but she didn't have a dog collar. So she went to the pet store and got her dog a new collar. She put the collar on the dog. She walked the dog for thirty minutes.
 selected sentence: She walked the dog for thirty minutes.
output: ",Kim gets a dog collar >Causes/Enables> Kim walks her dog
"input: story: Sal was a grumpy person. He had no friends and hated almost everything. He went to town to pick up gifts. They were for himself because he like almost no one. Later that night he cried himself to sleep.
 selected sentence: He went to town to pick up gifts.
output: ",Sal leaves home >Causes/Enables> Sal goes to town
"input: story: Kelly got home from work and decided to play with her daughter. The two had a tea party together. They drank tea from London and ate tea sandwiches. They also worse cute dresses. When the party was over they had supper.
 selected sentence: When the party was over they had supper.
output: ",Kelly and her daughter have a tea party together >Causes/Enables> The party is over and they have supper
"input: story: Olga's husband gave her new diamond earrings for her anniversary. She wore her new earrings to church the next Sunday. Halfway through the service, she realized one earring was missing. After the service ended, she crawled on her hands and knees to look. She was lucky and found her lost earring.
 selected sentence: She was lucky and found her lost earring.
output: ",She looks for her earring >Causes/Enables> She finds her earring
"input: story: It was my birthday. I went to school. I waited all day to go home and have my birthday party. I was very excited. When I got home the party was set up for my brother.
 selected sentence: I went to school.
output: ",School opens on my birthday >Causes/Enables> I go to school on my birthday
"input: story: Martha loved her husband. She wanted to get him Something special. One day she was working late at her job. She worked at Starbucks. Martha got her husband a delicious chocolate drink.
 selected sentence: She wanted to get him Something special.
output: ",Martha loves her husband >Causes/Enables> Martha wants to get her husband Something special
"input: story: Alicia loves taking baths. She takes one every night. She ran out of bubble soap last night. She couldn't take a bath tonight. She took a shower instead.
 selected sentence: She took a shower instead.
output: ",Alicia can't take a bath >Causes/Enables> She takes a shower instead
"input: story: My dog ate a whole plate of bacon by himself. He got a bad stomachache. We had to feed him some medicine. Once the medicine worked, he looked like he felt much better. He still ate bacon whenever he could find it.
 selected sentence: We had to feed him some medicine.
output: ",My dog gets a stomachache >Causes/Enables> My dog gets medicine
"input: story: Donald was drinking tea. It was out of a glass bottle. He dropped it by accident. It broke on the floor. Donald had to carefully clean up the glass.
 selected sentence: He dropped it by accident.
output: ",Donald holds a glass bottle >Causes/Enables> Donald drops the bottle
"input: story: Julie was on the couch when she saw her mom. She jokingly asked her mom to make her a sandwich. For some reason, her mom actually said yes. She went and made Julie a really nice sandwich. Then, she let Julie eat it on the couch.
 selected sentence: She jokingly asked her mom to make her a sandwich.
output: ",Julie sees her mom >Causes/Enables> Julie asks her mom to make her a sandwich
"input: story: The Smith family went to the county fair. After they ate corndog and cotton candy they watched a circus. When the circus was over they all rode the merry-go-round. On their to their car they played games for prizes. It was such fun they decided to make it a tradition and go every year!
 selected sentence: The Smith family went to the county fair.
output: ",The Smith family decide to go to the fair >Causes/Enables> The Smith family go to the fair
"input: story: Chrisana and her niece went for a walk around the block. They stopped at a park. At the park, they rode the swings. Then, they kept walking. Eventually, they made it back home.
 selected sentence: Eventually, they made it back home.
output: ",Chrisana and her niece go for a walk >Causes/Enables> Chrisana and her niece come back home
"input: story: A new family moved in next door to Sam. They had a little girl. When Sam went to meet her, he found Something strange. The little girl was blind! Sam decided it'd be cool to have a blind friend.
 selected sentence: They had a little girl.
output: ",A woman gets pregnant >Causes/Enables> The couple has a little girl
"input: story: Lily loved chicken nuggets. She decided to make some for herself. She got all the ingredients and set to work. When they were done, she was pleased with her work. However, when she tasted them, she realized she still needed practice.
 selected sentence: However, when she tasted them, she realized she still needed practice.
output: ",Lily makes nuggets >Causes/Enables> Lily tastes the nuggets
"input: story: Little shavings of wood fell to floor. Carly watched her grandpa eagerly. He had been carving Something for her for two weeks. Finally, he smiled at her and held out his hands. It was a little wooden bear all of her own!
 selected sentence: Little shavings of wood fell to floor.
output: ",Carly's grandpa carves >Causes/Enables> Wood shavings fall to the ground
"input: story: My boyfriend in high school was crazy. We had only been dating 1 month when it was Christmas. His family was on vacation and their car broke down. In order to make it back, my boyfriend rented a Uhaul. His parents drove and he rode in the back for 1000 miles!
 selected sentence: His parents drove and he rode in the back for 1000 miles!
output: ",My boyfriend's parents enter the Uhaul >Causes/Enables> My boyfriend's parents drive
"input: story: Gina's mom promised they would go home in 3 days. But 4 days had passed. She asked her mother again. Her mother yelled at her for asking. She was tired of being asked when they were leaving.
 selected sentence: She asked her mother again.
output: ",4 days pass >Causes/Enables> Gina asks her mom again
"input: story: Kenny was lost on the streets. A driver stopped on the side of the road. He asked Kenny if he needed help. Kenny gave her the address to his house. The driver ended up finding it and dropped him off.
 selected sentence: Kenny was lost on the streets.
output: ",Kenny makes a wrong turn >Causes/Enables> Kenny is lost
"input: story: Sam was excited go to shopping. He had a coupon that gave him a great deal. Sam got everything he wanted and went to pay. The cashier gave him terrible news about the coupon. It had just recently expired.
 selected sentence: Sam was excited go to shopping.
output: ",Sam goes shopping >Causes/Enables> Sam is excited to go shopping
"input: story: Tim got a job as a cashier. His first day was rough. His drawer was 30 dollars short. Tim tried really hard that week. After a month he was the best cashier at his job.
 selected sentence: After a month he was the best cashier at his job.
output: ",Tim gets a job >Causes/Enables> Tim becomes the best cashier
"input: story: Cora was starting her job as a kindergarten teacher. She worked that her young students wouldn't like her. But her first day went very well. All the kids had a great time. At the end of the day, they all told her how much they liked her!
 selected sentence: She worked that her young students wouldn't like her.
output: ",Cora was starting a job as a kindergarten teacher >Causes/Enables> Cora worried that her students wouldn't like her
"input: story: Yesterday I went to the clothing store. When I got there I was waiting for about an hour. I couldn't believe how long the line was. When I was done shopping, I was waiting three hours. I knew never to go back again.
 selected sentence: When I got there I was waiting for about an hour.
output: ",I head to the store >Causes/Enables> I arrive at the store
"input: story: We all went to a haunted house last Halloween. A creepy clown jumped out at my friend Gary. Gary was so scared he screamed. We all think Gary wet himself. Gary ran home to change his pants.
 selected sentence: A creepy clown jumped out at my friend Gary.
output: ",We go to a haunted house >Causes/Enables> A creepy clown jumps out 
"input: story: I turned twenty years old. My girlfriend didn't realize it was my birthday. I tried to drop hints but she didn't get the message. Then I shouted at her for not remembering my birthday. I realized she was not worth the time so I dumped her.
 selected sentence: I turned twenty years old.
output: ",My birthday approaches >Causes/Enables> I turn twenty
"input: story: Joey was a notoriously picky eater. He especially hated vegetables. His grandmother served his Something green that looked like spears. She told him to pretend he was destroying light sabers as he ate them. So the asparagus wasn't so bad after all.
 selected sentence: Joey was a notoriously picky eater.
output: ",Joey hates vegetables >Causes/Enables> Joey is a notoriously picky eater
"input: story: A guy I like finally asked me out on a date. The date went well and I was excited for him to kiss me in the car. When we get home, he tries to do that. Instead, he grabs my neck to pull him toward him. Long story short, I'm wearing a neck brace.
 selected sentence: The date went well and I was excited for him to kiss me in the car.
output: ",I go on a date >Causes/Enables> The date goes well
"input: story: My daughter got this toy dog for her birthday that barks all day long. It was fine at first. It didn't bother me. But one day we went on a long road trip. Let's just say the dog didn't make it back from that trip.
 selected sentence: But one day we went on a long road trip.
output: ",We decide to go >Causes/Enables> We go
"input: story: Kate was cooking dinner. Her husband got home from work. He tried to sneak up and hug her. Kate had a knife in her hand and stabbed him by accident. She had to call 911 for help.
 selected sentence: Her husband got home from work.
output: ",Kate's husband goes to work >Causes/Enables> Kate's husband comes home
"input: story: I gave my gift to sally. She was amazed at it since she needed a toaster. When Tanya gave her gift to me, I was beyond excited. It was a set of Spanish Language books. I immediately began studying.
 selected sentence: I gave my gift to sally.
output: ",I buy a gift >Causes/Enables> I give the gift to Sally
"input: story: Mike didn't study for a test. The test was very hard. Mike looked at his friend's answers. The teacher caught Mike cheating. The teacher was very disappointed.
 selected sentence: The teacher caught Mike cheating.
output: ",Mike was cheating on a test >Causes/Enables> The teacher caught Mike cheating 
"input: story: Julie was a mean girl. Nobody liked her but they always gave in to her. The new girl, Ann, didn't let Julie bully her. Ann was worse than Julie. Julie wasn't a mean girl anymore.
 selected sentence: Nobody liked her but they always gave in to her.
output: ",Julie behaves poorly >Causes/Enables> No one likes Julie
"input: story: Ben was going home from work. He was very tired. All he could think about was to get some rest. When he opened the door, his friends screamed ""Surprise""! It was his Birthday.
 selected sentence: All he could think about was to get some rest.
output: ",Ben has a long day at work >Causes/Enables> Ben really wants rest
"input: story: Tom was out on a first date. It wasn't going so well. Tom's date looked visibly bored. He tried different things to entertain her but it didn't work. Eventually she went home early.
 selected sentence: Tom's date looked visibly bored.
output: ",Tom's first date isn't going so well >Causes/Enables> Tom's date looks visibly bored
"input: story: Silas wanted to find a new girlfriend. He used a dating service to make a blind date. His date did not show up. There was a girl there whose date did not show up too. They talked about their mutual problem, then began dating.
 selected sentence: They talked about their mutual problem, then began dating.
output: ",Silas and the girl decide to date >Causes/Enables> Silas and the girl date
"input: story: I ate pizza at the new place with my family. Later that night, I was watching tv when I began to feel ill. I became very sick, vomiting and staying in bed for days. It took over a week to feel better. By the time it was over, I could no longer stand the sight of pizza.
 selected sentence: I became very sick, vomiting and staying in bed for days.
output: ",I ate pizza >Causes/Enables> I got food poisoning from the pizza
"input: story: I've a friend who is pretty ill so I thought it best to call him. I called him over and over yesterday but he didn't answer. So I began to worry. Then wouldn't you know it he called me! So now I know my friend is OK and so I won't worry any more.
 selected sentence: I've a friend who is pretty ill so I thought it best to call him.
output: ",My friend gets ill >Causes/Enables> I think it best to call him
"input: story: Erin was walking home from school one day. He found a little stray dog who looked hungry. Erin took the dog home and began to feed it and wash it. The dog was really happy and Erin decided to keep it. Erin now goes to the park on weekends with his dog.
 selected sentence: The dog was really happy and Erin decided to keep it.
output: ",Erin feeds the dog >Causes/Enables> The dog is happy
"input: story: A rock was loose in the curb. A truck came along and knocked it from the curb. The rock now lay in the middle of the street. Another car came along and ran it over. The rock caused the car to get a flat tire.
 selected sentence: The rock caused the car to get a flat tire.
output: ",A car drove over a rock >Causes/Enables> The rock flattened a tire on the car 
"input: story: Carl went to the store to buy eggs. On the way home he dropped the carton. All of the eggs broke. Carl had to go back to the store to get more. He did so unhappily.
 selected sentence: Carl had to go back to the store to get more.
output: ",Carl dropped the carton of eggs and they broke >Causes/Enables> Carl went back to the store to buy more eggs
"input: story: There was a storm over Bill's house. He was very scared. He needed to take his mind off the storm. He played video games to busy himself. He had so much fun he forgot about the storm.
 selected sentence: There was a storm over Bill's house.
output: ",The storm moves over Bill's house >Causes/Enables> The storm is over Bill's house
"input: story: Ronnie decided to make a surprise visit with his mom. They live about four hours apart. He filled his gas tank and his cooler for the trip. He passed the time by listening to his radio. Before he knew it he was already giving his mom a big hug.
 selected sentence: They live about four hours apart.
output: ",Ronnie moves far away from his mother >Causes/Enables> They live four hours apart
"input: story: Camilla was at the park with friends. They discovered a nice smelling bush of flowers. One of the kids said that it was honeysuckle and tasted it. Camilla thought it was a trick but she tried a taste. To her surprise, it was sweet like honey.
 selected sentence: Camilla was at the park with friends.
output: ",Camilla goes to the park >Causes/Enables> Camilla is at the park
