input,output
"input: story: Dominick has a birthday coming. He wants a pair of work boots so bad. He told his parents that was what he wanted. His parents went and bought them for his birthday. Dominick was so happy to get his boots.
 selected sentence: He wants a pair of work boots so bad.
output: ",Dominick gets a job >Causes/Enables> Dominick wants a pair of work boots
"input: story: Davis was at his family's log cabin in the forest. He was spending some time by himself after a long week at work. He tried to light a fire outside, but the wood was too damp to light. Without a fire, Davis was not able to prepare any food. Davis decided to leave the cabin and go eat fast food.
 selected sentence: Without a fire, Davis was not able to prepare any food.
output: ",Davis can't start a fire >Causes/Enables> Davis can't cook food
"input: story: Tom went to the store and bought a phone. He was very excited and began to run home. He ran too fast and dropped his phone. His phone screen had cracked. He picked the phone up and walked home sadly.
 selected sentence: He was very excited and began to run home.
output: ",He buys a phone >Causes/Enables> He is excited
"input: story: Ethel was terrified of growing old alone. She kept a tight leash on her husband. Ethel couldn't allow him to go more than an hour without calling. Or texting, as he was doing when he missed the curve and crashed. Ethel lives alone, with nobody to blame for it but herself.
 selected sentence: She kept a tight leash on her husband.
output: ",Ethel decides to keep a tight leash >Causes/Enables> Ethel keeps a tight leash
"input: story: Kim had trouble sleeping one night. She closed her eyes. But she kept hearing an owl. She fell asleep at 4 AM. And saw an owl at her window when she woke up at noon.
 selected sentence: But she kept hearing an owl.
output: ",An owl lands near Kim's room >Causes/Enables> Kim hears the owl
"input: story: Amy and her friend were riding bikes on a summer afternoon. They decided to ride to her friend's cousin's house. There was a steep hill which was hard to ride up. Amy was sweating and panting as she rode up the hill. Amy ended up walking the bike up the hill instead of riding.
 selected sentence: There was a steep hill which was hard to ride up.
output: ",They ride to their friend's house >Causes/Enables> Amy struggles up a steep hill
"input: story: Terri's phone began to ring. She answered it quickly. It was her mother. She asked her how her day was. Terri said it was fine.
 selected sentence: She asked her how her day was.
output: ",Terri's mom calls her >Causes/Enables> Terri's mom asks about her day
"input: story: They opened a new ice cream shop down the street. The kids were so excited to try them out. We visited on Saturday. The make all their own ice cream. They were delicious.
 selected sentence: They were delicious.
output: ",We try the ice cream from the new ice cream shop >Causes/Enables> The ice cream is delicious
"input: story: Lisa was trying to steal a magazine. She was on her way out of the door. Suddenly, an employee stopped her. She had been caught. Her dad had to come pick her up and pay a fine.
 selected sentence: She had been caught.
output: ",Lisa tries to steal >Causes/Enables> Lisa gets caught
"input: story: It had been a long day of working outside. I decided I needed a shower before dinner. After disrobing, I stepped into the shower. I washed all the part of my body. After I was done, I was clean and feeling great.
 selected sentence: I decided I needed a shower before dinner.
output: ",I get dirty >Causes/Enables> I decide to shower
"input: story: Tori decided to take her dog on a walk. They walked 4 miles in the cold weather. She froze the whole time. When she got home, she felt like she was getting a cold. Tori decided that she was going to wear more layers next time.
 selected sentence: They walked 4 miles in the cold weather.
output: ",Tori takes her dog for a walk >Causes/Enables> They walk in the cold weather
"input: story: Linda finally put baby for a nap. She needed a break. She quietly left the kids room. The floor squeaked. The baby woke up.
 selected sentence: The baby woke up.
output: ",The baby goes to sleep >Causes/Enables> The baby wakes up
"input: story: Mary noticed her car's front left tire was looking very low in air. She had to put extra air in the tire 3 times in 1 month. Jane took her car to The Tire Store, and they checked the tire. The tire had an air leak, and mechanic fixed the tire. Jane took the car home, happy they fixed the tire leak.
 selected sentence: Jane took the car home, happy they fixed the tire leak.
output: ",Jane gets the car back >Causes/Enables> Jane takes the car home
"input: story: We went to my uncle's house. He had a bunch of four wheelers. We convinced my 87 year old grandmother to ride one. She got on the back with my uncle. She enjoyed the ride around his land.
 selected sentence: We went to my uncle's house.
output: ",We get in the car >Causes/Enables> We go to my uncle's house
"input: story: Missy was in Gym class. She needed to climb the rope. She wasn't sure she could do it. While she climbed, she just tried her best. She made it to the top of the rope.
 selected sentence: She needed to climb the rope.
output: ",Missy is in gym class >Causes/Enables> Missy needs to climb the rope
"input: story: Molly had fallen asleep with her hair in a bun. Now, her hair was very tangled. She tried to comb it but it wouldn't work. She decided to rub some coconut oil in it. Then, she was able to comb the hair out.
 selected sentence: Molly had fallen asleep with her hair in a bun.
output: ",Molly put her hair in a bun >Causes/Enables> Molly fell asleep with her hair in a bun
"input: story: Jim bought eggs. When he was ready to cook, he saw that they were all broken. This made him mad. However, he had a plan. He returned them at the store for a new batch.
 selected sentence: However, he had a plan.
output: ",Jim makes a plan >Causes/Enables> Jim has a plan
"input: story: Sara went to her parent's funeral on Sunday. It was a sunny day but no one else was present. That left Sara feel very alone in a world that was still happy. She went back home afterward to cry. And when she had no more tears, she looked at old photographs.
 selected sentence: She went back home afterward to cry.
output: ",Sara goes to a funeral >Causes/Enables> Sara cries
"input: story: One day Paul found a bush with large berries. He was very tempted to eat them but he didn't. He picked one and took it to his dad to check out. His dad said it was safe to eat so Paul ate some. They were so good that he picked enough for the whole family.
 selected sentence: They were so good that he picked enough for the whole family.
output: ",Paul eats the berries >Causes/Enables> The barries are good
"input: story: Jake and Zack love to hunt. Usually, they go together and during deer season. One year, Zack spotted a huge deer and he shot at it. They deer appeared to fall over but was nowhere to be found! They decided that the deer was smarter than them and they went home.
 selected sentence: They decided that the deer was smarter than them and they went home.
output: ",The deer is gone >Causes/Enables> Jake and Zack decide the deer is smarter than them
"input: story: A new family moved in next door to Sam. They had a little girl. When Sam went to meet her, he found Something strange. The little girl was blind! Sam decided it'd be cool to have a blind friend.
 selected sentence: Sam decided it'd be cool to have a blind friend.
output: ",Sam thinks it would be cool >Causes/Enables> Sam decides it would be cool
"input: story: Brian went to a supermarket. He needed some fruits. He took some apples and put it into his pocket. Somebody saw him. He was forced to pay for it.
 selected sentence: He was forced to pay for it.
output: ",Brian was trying to steal an apple >Causes/Enables> Brian was forced to pay for the apple 
"input: story: It was Sara's turn to let the dog outside. Sara opened the front door and let the dog run out. A couple hours later Sara remembered the dog and went to let him in. She noticed the gate was open and her dog was missing. Sara rushed to tell her mom that the dog was missing.
 selected sentence: It was Sara's turn to let the dog outside.
output: ",Sara has a dog >Causes/Enables> Sara needs to let the dog about
"input: story: I am starting on my third marriage. I am very worried about how it will work out. Until now, I never felt love for the men I was married to. Now that I do love one, he is not very kind. He hurts me every single day.
 selected sentence: I am starting on my third marriage.
output: ",I divorce my second wife after divorcing my first wife >Causes/Enables> I am starting my third marriage
"input: story: Dan hated minivans. But with a 4th kid on the way he had no choice. He drove the van to work. His friend Rob saw him and began laughing. Dan was angry with Rob the whole day.
 selected sentence: Dan was angry with Rob the whole day.
output: ",Rob laughs at Dan >Causes/Enables> Dan is angry
"input: story: Alan wanted a day off school. He wished for a hurricane or a snowstorm. But then one morning he woke very ill! He was vomiting and running a very high fever. Alan actually wished he could have been in school, instead of ill!
 selected sentence: Alan actually wished he could have been in school, instead of ill!
output: ",Alan wakes up very ill >Causes/Enables> Alan wishes he could have been in school instead of being ill
"input: story: Tom had been asking his parents for a cat for weeks. Finally, his parents told him they could get one kitten. Tom and his parents found a cat online and picked it up. When they brought it back, Tom took a nap with it. When Tom woke up, the cat was nowhere to be found anywhere.
 selected sentence: When Tom woke up, the cat was nowhere to be found anywhere.
output: ",Tom takes a nap with the cat >Causes/Enables> The cat is nowhere to be found when Tom wakes up
"input: story: I went into Lucy's room. She had her tea set out on her table. All her animals were seated at the table. She was serving them tea and cookies. It was a great tea party!
 selected sentence: All her animals were seated at the table.
output: ",Lucy puts the animals into the seats >Causes/Enables> The animals are in the seat
"input: story: Ann had never been on an airplane. Her family was going on vacation next month to Florida. She was scared the plane was going to fall down. Her friend told her there was nothing to worry about. Ann got on the plane, and the plane landed safely.
 selected sentence: Her friend told her there was nothing to worry about.
output: ",Ann worries about going on an airplane >Causes/Enables> Her friend tells her there is nothing to worry about
"input: story: Bob's friend AJ told him the dog park was a good place to meet girls. On Saturday morning he drove his dog to the park. A few minutes after they were done playing, a pretty girl sat down. Bob's dog ran over to see her dog. Bob ended up on a date next weekend with the pretty girl.
 selected sentence: A few minutes after they were done playing, a pretty girl sat down.
output: ",Bob and his dog go to the dog park >Causes/Enables> Bob and his dog play
"input: story: John won his baseball game and wanted some ice cream to celebrate. He went with his teammates to their favorite ice cream shoppe. John looked at the menu to decide what he wanted. He thought a milkshake would hit the spot. John drank his delicious shake and went home.
 selected sentence: John won his baseball game and wanted some ice cream to celebrate.
output: ",John wins his baseball game >Causes/Enables> John wants to celebrate
"input: story: I am starting on my third marriage. I am very worried about how it will work out. Until now, I never felt love for the men I was married to. Now that I do love one, he is not very kind. He hurts me every single day.
 selected sentence: He hurts me every single day.
output: ",I date a mean man >Causes/Enables> He hurts me
"input: story: The weather turned cold and foul by Jim's house. There was icy rain and the wind blew hard. Jim saw that his front steps were covered in ice. He took some salt from his garage and spread it on the steps. The ice melted a little so Jim added even more salt.
 selected sentence: He took some salt from his garage and spread it on the steps.
output: ",The front steps are covered in ice >Causes/Enables> Jim spreds salt on the steps
"input: story: Lisa had just finished up shopping. She was walking back to her car. She noticed that it was very hot outside. When she tried to sit in the car, she burnt her hand on the seat belt. She had to wrap it in a coat before she could use it.
 selected sentence: When she tried to sit in the car, she burnt her hand on the seat belt.
output: ",It is hot >Causes/Enables> She burns her hand on the seat belt
"input: story: When the summer came, Rico had to move back home. He was sad because he had made many new friends in Iowa. On the last day of school, Rico exchanged addresses with his friends. When Rico arrived home, he already had letters waiting for him. Rico has many new pen pals that he writes to every week.
 selected sentence: When Rico arrived home, he already had letters waiting for him.
output: ",Rico has to go home >Causes/Enables> Rico arrives at home
"input: story: Today I found out I'm highly allergic to cats. I had to tell my boyfriend that the cat can't sleep with us anymore. At about 1:30 this morning, I felt him get out of bed. I asked him where he was going so late. He said to sleep in the living room because the cat is sad.
 selected sentence: He said to sleep in the living room because the cat is sad.
output: ",Cat is not allowed in bed >Causes/Enables> Boyfriend decides to sleep with the cat in living room
"input: story: Today we had a snow day. I got to play in the snow. I built a snowman and an angel. It was really cold. I enjoyed playing in the snow today.
 selected sentence: Today we had a snow day.
output: ",Snow falls >Causes/Enables> We have a snow day
"input: story: Trenton loved apples. He decided to plant a tree. He dug a big hole and put the tree in. Next he patted in the dirt around. Last he watered it and waited for it to grow.
 selected sentence: He dug a big hole and put the tree in.
output: ",Trenton decided to plant a tree >Causes/Enables> Trenton dug a big hole for the tree
"input: story: Yesterday I went to the clothing store. When I got there I was waiting for about an hour. I couldn't believe how long the line was. When I was done shopping, I was waiting three hours. I knew never to go back again.
 selected sentence: When I was done shopping, I was waiting three hours.
output: ",I go to the line >Causes/Enables> I wait
"input: story: Stephen saw the snow come down. He waited for a phone call. The school called. They said school was closed. Stephen celebrated.
 selected sentence: Stephen saw the snow come down.
output: ",It snows >Causes/Enables> Stephen sees the snow
"input: story: Karen grew her own vegetables in her garden. She wanted to sell them but nobody wanted plain vegetables. She decided to try and sell coleslaw to her neighbors. They bought it up instantly! Karen has expanded her garden and now sells coleslaw full-time!
 selected sentence: They bought it up instantly!
output: ",Karen tries to sell coleslaw to her neighbors >Causes/Enables> Karen's neighbors buy all the coleslaw
"input: story: Jan called and said her car didn't sound right. So I walked over to her place and drove her car around. It sounded to me like it needed a tune-up. So I gathered all my tools and the parts needed for a tune and did it. Now Jan tells me her car sounds and runs much better.
 selected sentence: So I walked over to her place and drove her car around.
output: ",Jan calls >Causes/Enables> I go to her place
"input: story: Gina had been tripped and had fallen in the sand. Her friend Tami grabbed her arm to help her up. Gina knew she looked a mess all covered in sand. She wiped her face, and Tami wiped her legs. Gina was so upset she began to cry.
 selected sentence: Her friend Tami grabbed her arm to help her up.
output: ",Gina fell down >Causes/Enables> Tami helped her up
"input: story: Lisa lost her tooth yesterday. She went to sleep and when she woke up she found Something. She got a dollar from the tooth fairy. Lisa was happy and went and bought candy with it. She couldn't wait to lose more.
 selected sentence: Lisa was happy and went and bought candy with it.
output: ",Lisa gets a dollar >Causes/Enables> Lisa buys candy
"input: story: Jed and his girlfriend were going out to a movie. They spent an hour getting nicely dressed up. They got in their car and began to drive. They turned on the radio and heard the theater was closed from rain. The couple turned around and went back home.
 selected sentence: The couple turned around and went back home.
output: ",Jed and his girlfriend drive to the movies >Causes/Enables> Jed and his girlfriend drive home
"input: story: Sadie was on the volleyball team. She had the ball in her hands. She went to spike it over the net. Suddenly, the ball smacked another girl in the face. Sadie apologized but was asked to leave the court.
 selected sentence: Suddenly, the ball smacked another girl in the face.
output: ",Sadie goes to spike >Causes/Enables> Sadie spikes
"input: story: Ed went outside to build a snowman. First he balled up the snow. Then he stacked three balls atop each other. He finished by adding the eyes and nose. Ed was very proud of his snowman!
 selected sentence: Ed went outside to build a snowman.
output: ",Snow falls >Causes/Enables> Ed goes to build a snowman
"input: story: They opened a new ice cream shop down the street. The kids were so excited to try them out. We visited on Saturday. The make all their own ice cream. They were delicious.
 selected sentence: The make all their own ice cream.
output: ",They open an ice cream shop >Causes/Enables> they shopkeepers make ice cream in the ice cream store
"input: story: Jake was walking home from school. He had to walk across the street. As he was crossing a car come out of nowhere. The car luckily stopped in time. Jake ran home he was fine but frightened.
 selected sentence: Jake ran home he was fine but frightened.
output: ",The car barely stops in time >Causes/Enables> Jake is scared
"input: story: Ed had been warned there were jellyfish in the water. He ignored the warnings and went in to swim anyway. He was in the water for a few minutes when he felt a burning pain. He looked down and saw a jellyfish touching his side. He got out of the water as fast as he could.
 selected sentence: Ed had been warned there were jellyfish in the water.
output: ",Someone gives Ed a warning >Causes/Enables> Ed is warned
"input: story: Kevin bought a new truck. It was snowing and he wanted to try his all wheel drive. He tried to go up a hill. He kept sliding regardless of what he tried. It was more ice than snow and too slippery even for his truck.
 selected sentence: It was more ice than snow and too slippery even for his truck.
output: ",Ice forms on the hill >Causes/Enables> The hill is too slippery
"input: story: Ike loved to fish. He went all year long. In the winter the ice fished. He caught lots of big ones. His family was sick of fish.
 selected sentence: He went all year long.
output: ",Ike loved to fish >Causes/Enables> Ike went all year long
"input: story: There was a little girl who owned a pet rock. She wanted to take it to school with her. She hid it in her backpack. She then showed all of her friends. Her teacher saw it and took it away forever.
 selected sentence: There was a little girl who owned a pet rock.
output: ",The girl gets a pet rock >Causes/Enables> The girl owns a pet rock
"input: story: Eddie and Carol were on their way home, driving across the country. There was no reason for them to get home right away. They decided to take their time and stop at lakes to swim, everyday. It was a hot summer, and those hours spent swimming cooled them off. These lake breaks made the trip longer, but well worth it.
 selected sentence: These lake breaks made the trip longer, but well worth it.
output: ",Eddie and Carol decided to stop at lakes to swim everyday >Causes/Enables> These lake breaks made their trip longer
"input: story: Today was the first day of art class. I was very excited to meet my new teacher. When I got to class the teacher was very nice. We painted and had no homework. I really like my new art class teacher.
 selected sentence: I really like my new art class teacher.
output: ",The teacher acts nicely >Causes/Enables> I like the teacher
"input: story: Friday night is movie night at our house. My kids pick the movie. My wife makes the popcorn. I make the drinks. We all fall asleep on the couch before the end of the movie.
 selected sentence: My kids pick the movie.
output: ",Friday night is movie night >Causes/Enables> My kids pick the movie
"input: story: Nicole forgot her lunch at home. She did not want to buy school lunch. She called her mom. Her mom brought the lunch to her. Nicole was happy she got to eat her home lunch.
 selected sentence: She did not want to buy school lunch.
output: ",Nicole forgets her lunch >Causes/Enables> Nicole does not want to buy a school lunch
"input: story: Reese was at school. He was taking a test when his head began to hurt. His teacher sent him to the nurse's office where he laid down. The nurse hoped that laying down would help him feel better. Unfortunately, it didn't so he had his mom pick him up.
 selected sentence: He was taking a test when his head began to hurt.
output: ",Reese goes to school >Causes/Enables> Reese is taking a test
"input: story: Sally's mother woke her up for school. Sally told her that she did not feel very well. Her mother checked her temperature. Her temperature showed she had a fever. So her mother took her to the doctor for medicine.
 selected sentence: Her mother checked her temperature.
output: ",Sally says she feels sick >Causes/Enables> Sally's mother checks her temperature
"input: story: My son went outside to play. A few hours after he came back in, my neighbor came over. He said he wanted to tell me how helpful my son was. He told me how he helped him rake leaves on his lawn. I went and found my kid and told him how proud I was.
 selected sentence: He said he wanted to tell me how helpful my son was.
output: ",My neighbor comes over >Causes/Enables> My neighbor says he wants to tell me how helpful my son was
"input: story: Today I surprised my daughter with a new pet cat. She was very happy. The next day, she started to sneeze a lot. It turned out that she was allergic to cats. I had to give the cat to my friend.
 selected sentence: Today I surprised my daughter with a new pet cat.
output: ",I decide to surprise my daughter >Causes/Enables> I surprise my daughter
"input: story: Kelly and her friends decided to go for a drive. The girls wanted to see the town. They were having a lot of fun, however Something happened. They got a flat tire. Thankfully though, Someone came to help.
 selected sentence: They got a flat tire.
output: ",Kelly and her friends decided to go for a drive >Causes/Enables> Kelly and her friends got as flat tire
"input: story: Amy decided to open the curtains and let light into the house. She pulled back one of the curtains on her bedroom window. The nail holding the curtain rod fell, the curtains on the floor. Amy looked and looked, but was unable to locate the nail. Amy decided to leave the curtains down and enjoy the sun.
 selected sentence: She pulled back one of the curtains on her bedroom window.
output: ",Amy decides to open the curtains >Causes/Enables> Amy pulls back the curtain
"input: story: Sam was the father of 5. One of Sam's boys needed help. He begged his father for money. Sam told him he could not help him. Sam did not give him any money.
 selected sentence: He begged his father for money.
output: ",The boy needs help >Causes/Enables> The boy begs Sam for money
"input: story: Little Jimmy loved to climb trees. His mother thought it was dangerous. One day when his mother wasn't watching, he climbed a big tree. Jimmy fell and broke his ankle. Jimmy never climbed a tree again.
 selected sentence: His mother thought it was dangerous.
output: ",Jimmy loves to climb trees >Causes/Enables> His mother thinks this is dangerous
"input: story: Ben and his friends were hanging out. One of his friends made fun of Ben and made him mad. Ben began to argue with his friend who continued name calling. Ben decided to fight him, and the two fought for a minute. Ben's other friend ran over and separated the two and they stopped.
 selected sentence: One of his friends made fun of Ben and made him mad.
output: ",Ben and his friends are hanging out >Causes/Enables> One of Ben's friends makes fun of Ben and makes him mad
"input: story: One time when me and a friend were walking down the street. She told me that she was extremely thirsty. I asked an old lady for a glass of water. She went into her house to get a glass. My friend drank the water.
 selected sentence: I asked an old lady for a glass of water.
output: ",My friend tells me she is thirsty >Causes/Enables> I ask for water
"input: story: John was always really good at Soccer, so he decided to challenge Joe. Joe couldn't pass this up, and they began to play. They were both evenly matched, but Joe was pulling ahead. In the end, Joe won by over 30 points. They both laughed it off and went and got ice cream together.
 selected sentence: They were both evenly matched, but Joe was pulling ahead.
output: ",Joe scores more points in the soccer match >Causes/Enables> Joe pulls ahead in the soccer match
