input,output
"input:  Person1:     How is your new car ?  
 Person2:  Perfect . Couldn't be better .  
 Person1:      Why do you say so ? Can I see your new car ?  
 Person2:  Of course you can . ( Lead Carl to his garage . )  
 Person1:      Wow , this new car is dynamite ! It is a shiny , beautiful car .  
 Person2:  My car is simply a daisy . It drives smoothly .  
 Person1:      The car has very sleek lines . I love it .  
 Person2:  I am glad to hear that . I'm really pleased with it .  
 Person1:      You made a good choice . 
output: ",1
"input:  Person1:     Hi , charlie , are you busy this evening ?  
 Person2:  Sorry , I'm afraid that I've got plans tonight .  
 Person1:      What are you doing ?  
 Person2:  I'm going to my parents ' house for my father's birthday .  
 Person1:      How old is he today ?  
 Person2:  It's his 50th birthday .  
 Person1:      Well , wish him a happy birthday for me .  
 Person2:  Sure thing . What are your plans for the evening ?  
 Person1:      I was just thinking of going to a movie tonight .  
 Person2:  Well , if you can wait until tomorrow night , I'll go with you then .  
 Person1:      Sorry , I've got people coming over tomorrow night .  
 Person2:  Sounds like this weekend just isn't going to work out for us .  
 Person1:      Sounds that way . Maybe some other time then ?  
 Person2:  Sure.Hey , I'm sorry , but I've got to get going .  
 Person1:      Yeah , me , too . It's about time I made a move .  
 Person2:  Say hello to your friends for me .  
 Person1:      Likewise . See you later .  
 Person2:  Bye ! 
output: ",1
"input:  Person1:     What type do you have in your mind ?  
 Person2:  A compact please . What's the daily rate for that car ?  
 Person1:      Thirty dollars a day .  
 Person2:  Does the rate include the cost of gas ?  
 Person1:      No , you have to pay it by yourself . 
output: ",1
"input:  Person1:     It ’ s very kind of you to invite me to dinner .  
 Person2:  Please sit down and make yourself at home . Please don ’ t stand on ceremony .  
 Person1:      This dish is really delicious .  
 Person2:  I ’ m glad that you like it . This is only the first time that I made it .  
 Person1:      You ’ re great . Could you say it in Chinese ?  
 Person2:  Sure , we call it doubt . 
output: ",0
"input:  Person1:     What do you think of that situation comedies showed every weekend ?  
 Person2:  To tell you the truth , I don't think much of them .  
 Person1:      You're becoming a real television watcher .  
 Person2:  A lot of people feel the same way . 
output: ",1
"input:  Person1:     Would you please tell me something about the agriculture and industry of New Zealand ?  
 Person2:  The agriculture in New Zealand is highly mechanized . The industry mainly focuses on the manufacture of agriculture and stockbreeding products .  
 Person1:      I see .  
 Person2:  If you need any further information , please don't hesitate to ask me .  
 Person1:      OK , I will . 
output: ",1
"input:  Person1:     Do you think I should ask Bob to help ? Will he come ?  
 Person2:  No problem . You know him . He ’ s the kind of guy that ’ s always willing to go the extra miles .  
 Person1:      That ’ s right . But I have bothered him several times .  
 Person2:  I bet he will come . 
output: ",1
"input:  Person1:     Excuse me , is this the Guyon Travel Agency ?  
 Person2:  Yes , sir . What can I do for you ?  
 Person1:      I want to travel to the ancient town in the south of China . Would you please tell me something about it ?  
 Person2:  Sure . There's network of canals . And there are white walls , black tiles , small bridges , flowing rivers , flagstones roads , blue sky and white clouds . Few places have preserved the past like this place . Walking on the ancient road makes us back to our sense .  
 Person1:      Wonderful . That's just what I expect , where is my first place if I go there ?  
 Person2:  Zhouzhuang .  
 Person1:      How long does the tour take ?  
 Person2:  It's about two days .  
 Person1:      what's the cost ?  
 Person2:  It's about 300 yuan .  
 Person1:      I know . Thank you very much .  
 Person2:  That's all right . May you have a good trip !  
 Person1:      Thank you .  
 Person2:  My pleasure . 
output: ",1
"input:  Person1:     What's bothering that guy ?  
 Person2:  Nothing . He's just got a chip on the shoulder . 
output: ",1
"input:  Person1:     How should we commemorate the centenary of the founding of the university ? We have been given quite a large budget to pay for some events .  
 Person2:  We should certainly hold a big party for the professors and students . We could have a firework display .  
 Person1:      Do you think that we should invite alumni and former professors ?  
 Person2:  If we do , too many people might attend . Perhaps we should invited all of them , but make a small charge to attend .  
 Person1:      Good idea . We should also hold a series of presentations . We could have presentations on the history of the university , the courses we offer , and our links with other universities .  
 Person2:  Good idea ! I think we could also have presentations by former students on how their experience here helped them in their lives .  
 Person1:      We could have another on the successes of graduates from here .  
 Person2:  I think that we could also produce some merchandise for the centenary-you know , T-shirts , mugs , plates , pens , and things like that .  
 Person1:      That ’ s an excellent idea . Hopefully , we would be able to make a profit ! A few professors and students are writing a book on the history of the university .  
 Person2:  I ’ m looking forward to reading that . We could have book signings by famous professors an alumni .  
 Person1:      A group of students from the art and music faculty are producing a short film .  
 Person2:  I ’ m sure that will be very popular .. OK , let ’ s think about how we can put these ideas into practice . 
output: ",1
"input:  Person1:     what's the matter with you ? You look so upset and tired .  
 Person2:  My father failed in business .  
 Person1:      Oh , that's really tough .  
 Person2:  Maybe it is the most difficult period of my family have experienced .  
 Person1:      I can understand . By the way , is there anyway I can help ?  
 Person2:  No , not now . I have found a part-time job . So perhaps I can help my family to come over the difficulties .  
 Person1:      Oh , that's so great , bless you ! if you need me , I'll always be there .  
 Person2:  Thank you . 
output: ",1
"input:  Person1:     What's your favorite book ?  
 Person2:  It's Gone With the Wind .  
 Person1:      Why do you like it best ?  
 Person2:  I enjoy the various characters and the plot .  
 Person1:      Well . I like the Thom Birds best .  
 Person2:  Is it very interesting ?  
 Person1:      Sure . I like the writer's language , too .  
 Person2:  If I have a chance , I'll enjoy the book .  
 Person1:      Would you like to go to the bookshop with me ?  
 Person2:  That's a good idea.Let ' s go ! 
output: ",1
"input:  Person1:     Where's your better half ?  
 Person2:  She's at home . 
output: ",1
"input:  Person1:     Good morning . I'd like to buy 2 tickets .  
 Person2:  Have you brought your student card ?  
 Person1:      I didn't know you have student tickets so I left them in my bag .  
 Person2:  In that case , you have to buy two full fare tickets .  
 Person1:      Here is the money . 
output: ",0
"input:  Person1:     Good morning , Mr.Jones !  
 Person2:  Good morning , Miss Bell !  
 Person1:      Nice to see you again .  
 Person2:  Nice to see you too.It ' s been a long time .  
 Person1:      How is everything ?  
 Person2:  Just fine , and you ?  
 Person1:      Quite well , thank you .  
 Person2:  Did you drive yourself to the airport ?  
 Person1:      No , I was driven by my husband .  
 Person2:  Did someone meet you at the airport here ?  
 Person1:      Yes , thanks .  
 Person2:  Is this where we'll be holding the meeting ?  
 Person1:      No , the meeting will be held on the fourth floor . 
output: ",0
"input:  Person1:     Have a nice weekend !  
 Person2:  Thanks.You too !  
 Person1:      Do you have any plans ?  
 Person2:  Well , my family's away and I can't afford to do much.What about you ?  
 Person1:      Oh , I haven't decided what I'm going to do yet . 
output: ",0
"input:  Person1:     Could you tell me the right time , please ?  
 Person2:  Well . My watch says five past two . But it ’ s no use rely on it because it has been gaining and losing these last a few days .  
 Person1:      You have to go and fix it .  
 Person2:  Yes . I will . 
output: ",0
"input:  Person1:     What do you think is harder , reading or writing ?  
 Person2:  Well , they ’ re completely different . Reading is passive , and writing is active .  
 Person1:      I don ’ t think I understand what you mean . Could you explain a little more ?  
 Person2:  In reading you need to recognize language by seeing the words on the page and knowing what they are . In writing you have to produce language , you have to create your own words on a blank page .  
 Person1:      Oh , now I see what you mean . When you ’ re reading , you are just looking , but when you are writing , you are actually doing something !  
 Person2:  A reading knowledge of a language is larger and different from a writing knowledge . Don ’ t you think so ?  
 Person1:      I think I see what you mean . I can read Shakespeare but I definitely can ’ t write it .  
 Person2:  Exactly .  
 Person1:      So I have another question for you . What do you think is harder , speaking or understanding ?  
 Person2:  They ’ re both harder than reading or writing .  
 Person1:      In what way ?  
 Person2:  Because they are direct communication with another person , and there ’ s a time limit . This time limit is the most serious problem for foreigners , even for those who know lots of English .  
 Person1:      You are making me feel really discouraged .  
 Person2:  I ’ m not trying to discourage you . I ’ m trying to help you . You have to live with these difficulties . Isn ’ t it better to know about them ? The more you know about what you have to face , the better you ’ ll do . I promise ! 
output: ",1
"input:  Person1:     I always think everybody looks down on me  
 Person2:  Don't be that negative .  
 Person1:      How can you be optimistic ? You can see it in their eyes .  
 Person2:  I find it there is no meaning in living this world .  
 Person1:      Don't be that negative .  
 Person2:  Really , life is so boring . 
output: ",0
"input:  Person1:     People say that you never have a real winter in the South China , but I don't think so .  
 Person2:  Why ?  
 Person1:      I did experience a winter with snow in Kunming , the Spring City .  
 Person2:  With snow in Kunming ? That's crazy ! 
output: ",0
"input:  Person1:     Alison , would you like to have some more ?  
 Person2:  No thanks . I have had enough .  
 Person1:      Actually you haven't have much .  
 Person2:  To tell you the truth , I am on the diet .  
 Person1:      That sounds ridiculous . Why ?  
 Person2:  Well , I am gaining weight these days , and I have to watch my calories . 
output: ",0
"input:  Person1:     Hi , Paulo . How are things going ?  
 Person2:  Everything's going very well . The first phase of the project was finished three days ahead of schedule . We're on target to complete phase two by the beginning of week 40 .  
 Person1:      That's good news . What stage are you at now ?  
 Person2:  Well , we've just finished laying the cabling and we're waiting for the safety inspector to give us the go-ahead to continue . I'm just going to meet him . Do you want to come ? 
output: ",1
"input:  Person1:     Hi Julie , how are things going ?  
 Person2:  Everything is great , Tad . How are you ?  
 Person1:      I'm doing really well .  
 Person2:  Tad , I'm pretty hungry right now . Want to walk over and check out the food table ?  
 Person1:      Julie , do you know who that woman is over there by the window ?  
 Person2:  That is Mary . I heard that she's just moved in with Lee .  
 Person1:      I thought that he was with Malia .  
 Person2:  Oh , that relationship is history . Malia hooked up with a guy she met on holiday .  
 Person1:      I bet that Lee wasn't too happy with that !  
 Person2:  Actually , he was OK with it . They hadn't been getting along too well . 
output: ",1
"input:  Person1:     When can we expect you for dinner ? Can you come tonight ?  
 Person2:  Not tonight . I promised to go to a concert with my sister .  
 Person1:      Well ... How about Friday then ?  
 Person2:  That sounds fine .  
 Person1:      Good . Shall we say seven o'clock ?  
 Person2:  I'll be there . You're still a fabulous cook , aren't you ?  
 Person1:      That'll be for you to decide . I've got a new dish that I want to try out on you .  
 Person2:  I'm ready . I'll look forward to it all Friday ! 
output: ",0
"input:  Person1:     Rebecca Johnson speaking .  
 Person2:  I'd like to speak to someone in your Accounts Department , please .  
 Person1:      Just a moment ... I'm afraid there's nobody there right now . Could I take a message ?  
 Person2:  Yes , please . My name's Michael Caxton from one of your customers — Rosedale Investments .  
 Person1:      Sorry , just a moment . The name is Caxton ...  
 Person2:  No , it's Caxton .  
 Person1:      Fine , I've got that . And your company is ...  
 Person2:  Rosedale Investments .  
 Person1:      Could you spell that , please ?  
 Person2:  It's R , O , S , E , D , A , L , E .  
 Person1:      Thank you . And the message ?  
 Person2:  It's about an invoice which is wrong .  
 Person1:      Have you got the number there ?  
 Person2:  Um ... yes ... it's 856674 / ros .  
 Person1:      856674 .  
 Person2:  That's right .  
 Person1:      OK , I'll get someone to phone you first thing in the morning .  
 Person2:  Thank you very much . 
output: ",0
"input:  Person1:     Dora , are you interested in going to the museum with me tomorrow ? I read the newspaper this morning . I know there is an art exhibition in Taipei Modern Art Museum .  
 Person2:  Sure . I am free tomorrow . It sounds interesting to me . Can we buy the ticket online ?  
 Person1:      I don't think so . I think we had better go there earlier , or we may have to spend a lot of time waiting .  
 Person2:  I guess that is the thing we can do with we really want to visit the museum .  
 Person1:      Look at the ticket booth in the center . There seems to be not as many people as we thought it would be .  
 Person2:  Yeah . We are lucky . Let's go buy the tickets first . We can have breakfast later . I am so hungry .  
 Person1:      Good idea .  
 Person2:  ( After the breakfast ) Which floor is the art exhibition we are going to ?  
 Person1:      I have no idea . Let me take a closer look at my museum map  
 Person2:  Sure , take your time . We have a whole day .  
 Person1:      It's on the 2nd floor . We are going to see some beautiful paintings about the history of ancient Greece .  
 Person2:  Look at the museum guide.It says there are also some sculptures and potteries in this area . Let's rent an audio guide . 
output: ",0
"input:  Person1:     He is so kind . I couldn ’ t believe he murdered his wife .  
 Person2:  Of course not . I believe he ’ s innocent .  
 Person1:      I don ’ t understand .  
 Person2:  He nursed a viper in his bosom . His best friend Tony foamed him in . Tony first seduced his wife and then trapped him . 
output: ",0
"input:  Person1:     how did you do on your BELTS exam ?  
 Person2:  fantastic ! I got an overall score of eight .  
 Person1:      that's excellent ! Have you received your conditional offers yet ?  
 Person2:  yes . I'm just waiting until I officially get admitted to the university with a conditional offer to apply for my visa .  
 Person1:      do you know where the visa office is ?  
 Person2:  no .  
 Person1:      it's just near the Dong Si Shi Tiao subway stop .  
 Person2:  that's not too far away . Do you think I'll get a visa ?  
 Person1:      have you ever gone abroad before ?  
 Person2:  yes , I've been to Tailband , Egypt , and Japan .  
 Person1:      have you ever been denied a visa before ?  
 Person2:  never .  
 Person1:      that's good . Are you planning on immigrating to another country ?  
 Person2:  no , I want to come back to China after I graduate .  
 Person1:      that's exactly what the visa officers want to hear . Do you have enough money for tuition and room and board ?  
 Person2:  I've received a full scholarship , so I won't need any other money to live off while I'm studying .  
 Person1:      I think you have a very good chance of getting a visa . I can help you prepare for the visa interview if you want .  
 Person2:  that's be great . The more prepared I am , the better . 
output: ",1
"input:  Person1:     Where are you going ?  
 Person2:  I'm going to Bill's house .  
 Person1:      What are you going to do there ?  
 Person2:  I'm going to help him .  
 Person1:      What's he doing ?  
 Person2:  He's fixing his roof . 
output: ",1
"input:  Person1:     What time do you have ?  
 Person2:  A quarter past five .  
 Person1:      I must be off now . I'm pressed for time .  
 Person2:  See you . 
output: ",1
"input:  Person1:     how do you usually get to school ?  
 Person2:  I usually ride my bike . Which form of transport do you prefer to use ?  
 Person1:      I feel that I can see more when I pedal a bicycle , but when I feel lazy , I drive my car .  
 Person2:  I think we should discourage people from using their private cars . They produce too much pollution !  
 Person1:      I agree , but I would find it difficult to stop using my car . It's just so convenient .  
 Person2:  cars might be convenient , but they're so bad for the environment .  
 Person1:      do you have a car ?  
 Person2:  no . I used to have one though . Once I started using my bicycle to get around , I found that I didn't really need it .  
 Person1:      maybe if I sold my car now , I wouldn't be so tempted to use it .  
 Person2:  you could try . It would save you a lot of money .  
 Person1:      that's true . Every month , I spend hundreds of dollars on gas , insurance , and repairs .  
 Person2:  if you got to class by riding a bicycle every day instead of driving , you will get lots of exercise , too !  
 Person1:      I could stand to lose a few pounds . Having a car has made me lazy . I never end up walking anywhere !  
 Person2:  let's go to a car dealership . I'll help you try to sell your car for a good price .  
 Person1:      sounds good ! Let's go ! 
output: ",1
"input:  Person1:     What courses are you taking ?  
 Person2:  Chinese , maths , English , chemistry , physics , biology and so on .  
 Person1:      What do you think about the teachers ?  
 Person2:  To be honest , I like most of them , except for my Chinese teacher . She is quite young , but her class is too boring !  
 Person1:      That's too bad . Do you have any foreign teachers ?  
 Person2:  Yes , my oral English teacher is an American . He is from a small town in California .  
 Person1:      What is he like ?  
 Person2:  He is great . He always tells us not to study for exams , and to pay more attention to communication rather than just memorizing .  
 Person1:      Are you able to follow him ?  
 Person2:  Not everything , but nearly . He speaks very clearly .  
 Person1:      Oh , that's good ! He sounds like a good teacher .  
 Person2:  Absolutely ! If you come to our class , I am sure you will like him . 
output: ",1
"input:  Person1:     I ’ m trying to decide what school to apply for .  
 Person2:  Are you thinking about a public school or a private one ?  
 Person1:      I ’ m not sure . What ’ s the difference between them ?  
 Person2:  Public schools are usually state funded , whereas private schools usually get their funding elsewhere .  
 Person1:      Which is better ?  
 Person2:  One isn ’ t necessarily better than the other . It depends a lot on the school administration and the teachers .  
 Person1:      I hear you have to wear uniforms at private schools .  
 Person2:  Yeah , sometimes . 
output: ",0
"input:  Person1:     Why do you want to go to the U . S . ?  
 Person2:  I want to enrich my knowledge in management . The United States is an ideal place for me .  
 Person1:      What will you do when you come home ?  
 Person2:  Before I work in the office , I was a teacher . So if possible , I'd like to come back to some school to pass on my new knowledge to more people .  
 Person1:      Do you feel your English is good enough for the course ?  
 Person2:  Yes . You know , English is my present working language . Besides , I scored very high in TOEFL .  
 Person1:      Who will be your supporter during your stay in the States ?  
 Person2:  I will support myself . In recent years , I have saved enough money for my study in the U . S .  
 Person1:      How long do you expect to stay there ?  
 Person2:  I will be there for three years . 
output: ",1
"input:  Person1:     Do you think you will ever work at that company again ?  
 Person2:  When pigs fly ! 
output: ",1
"input:  Person1:     I need to buy a bus pass .  
 Person2:  What kind of bus pass would you like to buy ?  
 Person1:      What are the different kinds ?  
 Person2:  You can get a day , weekly , monthly , or student pass .  
 Person1:      Could I get a student pass , please ?  
 Person2:  Sure , can I see your student ID ?  
 Person1:      Sure , here it is .  
 Person2:  Very good .  
 Person1:      How much for the pass ?  
 Person2:  It's free , but the monthly sticker is $ 24 .  
 Person1:      Okay , I'll take it .  
 Person2:  Thank you for your purchase .  
 Person1:      You are welcome . 
output: ",0
"input:  Person1:     I'm so hungry . Shall we go eat now , Rick ?  
 Person2:  Sure . Where do you want to go ? Are you in the mood for anything in particular ?  
 Person1:      How about some dumplings ? I just can't get enough of them .  
 Person2:  Dumplings again ? ! Oh , Amy , let's try something new !  
 Person1:      Well , what do you have in mind ?  
 Person2:  How about the Mongolian hot pot ?  
 Person1:      Oh , it's too spicy for me . Don't you remember last time when I tasted the lamb ? It Was so spicy my eyes teared up !  
 Person2:  Maybe we can try ' Yuanyang pot ' this time . You can choose the non-spicy soup base .  
 Person1:      Sounds great . Do they serve noodles ? I am in the mood for some tasty noodles as well .  
 Person2:  Yes . The sliced noodles they offer are among the most authentic Shanti cuisines .  
 Person1:      Great . Let's go !  
 Person2:  Wait a minute . Let me throw on a sweater . 
output: ",0
"input:  Person1:     New York Airport.May I help you ?  
 Person2:  Yes . I am calling to make sure if flight CG877 will arrive on time ?  
 Person1:      Hold on a moment please ... Sorry , the flight from London has been delayed . It departed two hours later than scheduled.The whether in London was really bad .  
 Person2:  You mean it will arrive two hours later than usual ?  
 Person1:      So far we could only deduce this way.If you want further information , would you please call us 1 hour later ?  
 Person2:  OK , thank you . 
output: ",1
"input:  Person1:     What else , Ma'am ?  
 Person2:  No , thanks . My husband said , We'd like to pay now .  
 Person1:      Let me show you to the cashier's . It's 905 yuan in total .  
 Person2:  What ? Where does that five come from ?  
 Person1:      Oh , it's a service charge .  
 Person2:  But I only have 900 in cash here . Can you let it go for 900 yuan ?  
 Person1:      Sorry , but we can't do that . It's store's rule .  
 Person2:  My husband said he had a credit card . Do you accept credit card ?  
 Person1:      Yes .  
 Person2:  Great . Here it is .  
 Person1:      Here is the receipt . Wanna to have it wrapped , Ma'am ?  
 Person2:  Yes , please . Thank you very much .  
 Person1:      It'll be great to have you again .  
 Person2:  Thank you very much . 
output: ",1
"input:  Person1:     Mr . Wilson . I'm very glad we reached the agreement at last . Now I'd like to propose a toast to the further development of our cooperation .  
 Person2:  I'm very delighted too . I'm sure that we'll have a wider range of cooperation . So , let's drink to the signing of our contract .  
 Person1:      Bottoms up !  
 Person2:  Cheers . 
output: ",0
"input:  Person1:     Can you tell me about a nice restaurant to go to ?  
 Person2:  Of course ! How much would you like to spend on your meal ?  
 Person1:      My date is quite sophisticated . She would expect nothing less than the best .  
 Person2:  Well , how about our own hotel restaurant ? It's conveniently located and has a three-star rating .  
 Person1:      That's a good idea , except I want to go out , not stay in . Something else , maybe ?  
 Person2:  Well , how about Gramercy Tavern ? It's a very popular tourist spot , with great food and music .  
 Person1:      That sounds good ! Could you call them to see if I can get a reservation ?  
 Person2:  Of course , sir . You've made a good choice . 
output: ",0
