input,output
"input:  Person1:     Could I speak to the apartment manager ?  
 Person2:  I am the apartment manager . How can I help you ?  
 Person1:      I wanted to know if that apartment on Main Street is still for rent .  
 Person2:  I haven't rented it out yet . Would you like to see it ?  
 Person1:      Yes , I want to see it .  
 Person2:  How about today at 6 p . m . ?  
 Person1:      That time is okay with me .  
 Person2:  Very good . We'll meet at 6 . Do you need directions ?  
 Person1:      No , thank you . I go by there on my way to work .  
 Person2:  If you're interested , you can fill out an application form .  
 Person1:      That's a good idea . Do I need to bring anything myself ?  
 Person2:  No . The only thing I need to see is your driver's license . 
output: ",0
"input:  Person1:     What may I do for you ?  
 Person2:  I need to get a passport .  
 Person1:      You will need to apply for one .  
 Person2:  When will I be able to do that ?  
 Person1:      You can do it right now , if you ’ d like .  
 Person2:  That ’ s fine .  
 Person1:      Please fill out this application .  
 Person2:  Then what do I do ?  
 Person1:      I just need to take your picture .  
 Person2:  How long will it take for my passport to be ready ?  
 Person1:      You will get it in a few weeks .  
 Person2:  That ’ s perfect . 
output: ",1
"input:  Person1:     Do you like singing ?  
 Person2:  Yes , I do .  
 Person1:      Let's go to a ETV tonight .  
 Person2:  But I can't sing it well .  
 Person1:      It doesn't matter . No one will laugh at you .  
 Person2:  OK , I'Il go with you . When shall we go ?  
 Person1:      What about six ?  
 Person2:  It's too early . Let's make it seven , OK ?  
 Person1:      OK . Let's make it . 
output: ",1
"input:  Person1:     Well , everything is packed and ready to go .  
 Person2:  It's hard to believe that we're really leaving . The past two weeks was like a dream .  
 Person1:      Yes . Just think the blue sky , sunshine , mouth-watering food , centuries-old castles - -  
 Person2:  And the people were so friendly !  
 Person1:      Yeah , we would have been lost without the help of the locals .  
 Person2:  Do you still remember the small restaurant at the corner of the street ?  
 Person1:      Of course . That was the best pasta I've ever had .  
 Person2:  I ate so much that I wasn't hungry until afternoon the next day .  
 Person1:      If only we could eat there once more !  
 Person2:  Maybe we can come here again next summer .  
 Person1:      Hope the restaurant is still there .  
 Person2:  Hey , what's the time ?  
 Person1:      Oh , my god ! Only two hours left before the plane takes off . We need to be at the airport now .  
 Person2:  Don't worry . We can call a cab . It'll be alright . 
output: ",0
"input:  Person1:     Hey Bob . Whatchy doing ?  
 Person2:  I'm at home painting .  
 Person1:      I didn't know you paint . What type of painting is it ?  
 Person2:  I enjoy oil painting . I learned it in one of my extra classes in college .  
 Person1:      That sounds so interesting . I wish I learned a hobby .  
 Person2:  Hobbies are never too late to learn . They offer a variety of classes at the local community college . You should look into it .  
 Person1:      I think I will . Thanks for the info . 
output: ",1
"input:  Person1:     I'm going on a guided tour in the mountain .  
 Person2:  You'll see the world-famous magnificent waterfall .  
 Person1:      I like the sight and the sound . It worked on me like a magic when I was a child  
 Person2:  Your dream will come true . It's really breathtaking 
output: ",0
"input:  Person1:     You heard who won the election , right ?  
 Person2:  Who was elected ?  
 Person1:      McCain won the election .  
 Person2:  That can ’ t be true !  
 Person1:      I ’ m upset , too .  
 Person2:  I can ’ t believe people voted for him .  
 Person1:      People must want him as our President .  
 Person2:  That doesn ’ t make any sense .  
 Person1:      I have more bad news .  
 Person2:  How could the news get any worse ?  
 Person1:      I was only kidding , because Obama won the election .  
 Person2:  That ’ s great news ! 
output: ",1
"input:  Person1:     what do you hope to do when you finish university ?  
 Person2:  I ’ d like to go into management . I ’ Ve applied for several jobs already and I ’ m hopeful that I ’ ll get some job offers . How about you ?  
 Person1:      after I graduate , I have to do some more studies to pass exams to become a lawyer . I think I ’ Ve got a good chance of passing . There ’ s a possibility of getting a job with a law firm in London , provide  
 Person2:  we both have to overcome several obstacles if we are to achieve our ambitions .  
 Person1:      if life were easy , then we ’ d achieve our ambition quickly and then get bored .  
 Person2:  unfortunately , it ’ s inevitable that some people are going to work hard yet not succeed .  
 Person1:      that ’ s why ambition need to be realistic . You can ’ t achieve something that ’ s totally unrealistic .  
 Person2:  as long as you plan carefully , most thing are possible . It ’ s always good to have a backup plan in case things go wrong .  
 Person1:      I think it ’ s important to be successful in a field you are truly interested in , not something that other people force you to be interested it .  
 Person2:  my father wanted me to become a doctor , but I knew it would be impossible for me to be successful in that field .  
 Person1:      I hope my parents don ’ t try to interfere in my choice of career . 
output: ",1
"input:  Person1:     This is where we sing ? These booths are so comfortable , I think I could fall asleep !  
 Person2:  Let's order something to eat . What are you in the mood for ?  
 Person1:      I'll have whatever you're having .  
 Person2:  OK . How about some fried spring rolls and squid balls , some pork skins , and some beer !  
 Person1:      Well ... the beer sounds good ! 
output: ",1
"input:  Person1:     Are you going to the party on Saturday ?  
 Person2:  I was thinking about it . Are you ?  
 Person1:      Yeah , I heard it's going to be a lot of fun .  
 Person2:  Really ? Well , what time does it start ?  
 Person1:      It starts at 8  
 Person2:  Well , who all is going to be there ?  
 Person1:      Everyone from school .  
 Person2:  How do you know it's going to be so fun ?  
 Person1:      This party is going to have a DJ , food , and drinks .  
 Person2:  Wow , that does sound like it's going to be fun .  
 Person1:      So am I going to see you at the party ?  
 Person2:  Yeah , I will be there . 
output: ",1
"input:  Person1:     Just dab it all over your face and then take a look at the symbols that appear .  
 Person2:  Yeah ... hearts , stars and some weird looking things .  
 Person1:      Those are money bags , and they represent your financial situation .  
 Person2:  So decode this for me , Madame Psycho .  
 Person1:      That's Madame Psychic to you .  
 Person2:  I'm waiting ...  
 Person1:      Well , you have three hearts — lucky in love tonight . Dress up and go on a date ! 
output: ",0
