input,output
"input:  Person1:     Did you have any hobbies ?  
 Person2:  Yes , reading is my hobby .  
 Person1:      What kind of books do you like to read most ?  
 Person2:  Many kinds of books . When I was a child in elementary school , I enjoyed reading fables and science fiction . When I became to a teenager at middle school , I was interested in detective mystery stories . Now I like reading romance stories .  
 Person1:      Are you in love ?  
 Person2:  Why ?  
 Person1:      People say only those that are in love like to read romance stories .  
 Person2:  Well , maybe . 
output: ",1
"input:  Person1:     Would you like this one ?  
 Person2:  I don't think that will do . How about the one at your back ?  
 Person1:      This one ?  
 Person2:  No , the other one ... yes .  
 Person1:      This one is especially built for hard , continuous play . And every detail of workmanship and material has been carefully checked to make it a dependable one for tournament use .  
 Person2:  It do look beautiful . Well . I think I'll take it.Now do you have any racket covers ?  
 Person1:      This cover comes with the racket .  
 Person2:  How much does it come up to ?  
 Person1:      The mark says six hundred yuan , plus tax , it's six hundred and eighty yuan .  
 Person2:  Do you accept credit cards ?  
 Person1:      Sure . If you'll just wait here , I'll be right with you in a minute . 
output: ",1
"input:  Person1:     This suit looks nice.Can I try it on ?  
 Person2:  Yes , of course.The dressing room is over there . 
output: ",0
"input:  Person1:     Hello , this is Lin Tao . I am calling to inquire about my interview result last week .  
 Person2:  Hi , I am sorry to say that your experience doesn't fit the job at all .  
 Person1:      Sorry to hear that , but could you inform me why I failed ?  
 Person2:  I have to say your education and experience are very outstanding , but it seems that you are not good at working in a team which we attach great importance to . 
output: ",1
"input:  Person1:     I heard that your previous manager was very capable , he is a good manger .  
 Person2:  That ’ s a matter of opinion .  
 Person1:      What do you mean ?  
 Person2:  I worked with him for two years . That was the worst time in my career . 
output: ",0
"input:  Person1:     Don't just stand outside . Come on in .  
 Person2:  Yeah .  
 Person1:      This is Alex . Remember ? This is Sean .  
 Person2:  Nice to meet you guys .  
 Person1:      Over there are Stacy and Rebecca . We're all on the school's tennis team .  
 Person2:  Who's that guy who's handing out beer to everyone ?  
 Person1:      That's my boyfriend Matt . Isn't he cute ?  
 Person2:  He sure is !  
 Person1:      Come on . I'll introduce you two . 
output: ",0
"input:  Person1:     I ’ d like to post this letter to Korea .  
 Person2:  Is it urgent ? Would you like the express service ?  
 Person1:      No thank you . I ’ d like to send it just by normal post . 
output: ",0
"input:  Person1:     You ran into my car .  
 Person2:  That was my fault . I'm sorry .  
 Person1:      You messed up my car .  
 Person2:  I don't see any damage .  
 Person1:      My rear bumper is messed up .  
 Person2:  I don't see anything wrong with it .  
 Person1:      It's smashed in .  
 Person2:  That's not my fault .  
 Person1:      The same thing is wrong with your bumper .  
 Person2:  I'll take care of everything . I just need your phone number and insurance .  
 Person1:      I need your information too .  
 Person2:  Here you go . 
output: ",0
"input:  Person1:     Happy Thanksgiving !  
 Person2:  You , too .  
 Person1:      Let's have pumpkin pie .  
 Person2:  It's my favorite . 
output: ",0
"input:  Person1:     It may comfort you to know that many people attended his viewing .  
 Person2:  How did they hear ? No one called .  
 Person1:      In times of loss , it is often hard to pick up the phone . But his whole family was here .  
 Person2:  His mom and dad must be destroyed . He was their only son .  
 Person1:      And he was so young , with so much life to look forward to .  
 Person2:  Yes ... thank you for understanding . We have to go now .  
 Person1:      This sheet tells the visiting hours and funeral time and location . 
output: ",0
"input:  Person1:     My eyes water continuously . Why ?  
 Person2:  Perhaps because of the dirty air .  
 Person1:      What is there in the air ?  
 Person2:  Some poisonous gas .  
 Person1:      I can't believe that the air in this city is so dirty .  
 Person2:  Yes . I think I won't come here again next time .  
 Person1:      So do I .  
 Person2:  We waste a vacation .  
 Person1:      Maybe you are right . 
output: ",1
"input:  Person1:     It is high time you have a talk with him . That may help clear the mists .  
 Person2:  I did , but he gives me a runaround .  
 Person1:      If I were you , I would put the whole matter on the table .  
 Person2:  But he was trying to beat about the bush . And my talk with him was fruitless . 
output: ",0
"input:  Person1:     Your total comes to $ 36.78 .  
 Person2:  Put it on my VISA .  
 Person1:      There ’ s a problem with your card .  
 Person2:  What ’ s wrong with it ?  
 Person1:      I believe it was declined .  
 Person2:  You ’ re kidding me !  
 Person1:      Do you have another card I could try ?  
 Person2:  I only have one card .  
 Person1:      Do you have cash , perhaps ?  
 Person2:  I don ’ t have any cash on me .  
 Person1:      You ’ re not going to be able to take these items today .  
 Person2:  I ’ ll be back tomorrow . 
output: ",0
"input:  Person1:     Did you get any rewards or honors in college ?  
 Person2:  Yes , I received the scholarship 3 times on end .  
 Person1:      Did you join the Communist Party of China ( CPC ) ?  
 Person2:  Yes , I joined the CPC when I was a freshman 
output: ",1
"input:  Person1:     I booked a double room for tonight . My name is Ruth Joy .  
 Person2:  Just a moment , please , while I check . That's correct.You have a double room on the fifth floor . 
output: ",0
"input:  Person1:     I have lots of friends .  
 Person2:  Really ? How many do you have ?  
 Person1:      I don't know , maybe one hundred .  
 Person2:  That is a lot of friends . Do you have a best friend ?  
 Person1:      Of course . I have lots of best friends .  
 Person2:  How many best friends do you have ?  
 Person1:      I think about twenty-five .  
 Person2:  Hmm . I have only one best friend .  
 Person1:      I feel sorry for you .  
 Person2:  I have only a few friends .  
 Person1:      You must be lonely . I will share my friends with you .  
 Person2:  That's very nice of you . 
output: ",0
"input:  Person1:     Why don't we Chinese have our own Valentine's Day ?  
 Person2:  Of course we have . It's on the seventh day of the seventh lunar month .  
 Person1:      Oh ? Why is that day ?  
 Person2:  It is said that the Cowherd and the Spinster , the lover stars in heaven , can only meet on the seventh Eve , so this day has become the Lover's Day . 
output: ",1
"input:  Person1:     Hey , Ben ... did you catch the game last night ?  
 Person2:  Uh ... what game ?  
 Person1:      Baltimore defeated Texas by 17 points !  
 Person2:  Um ... and what sport are we talking about here ?  
 Person1:      Football of course !  
 Person2:  Oh ... football . Football is cool . I usually try to catch the World Cup finals .  
 Person1:      No , I'm talking about American football . The World Cup is soccer .  
 Person2:  Oh , I understand . I can't say I'm a big fan . I'm from China , and football doesn't have a really big following over there .  
 Person1:      So Chinese people prefer soccer or basketball ?  
 Person2:  Yes , I think so . But to be perfectly honest , I'm not really a sports nut.When I was in high school I played on the school volleyball team . Are you a diehard football fan ?  
 Person1:      Oh , certainly . I wouldn't miss a game for the world . My girlfriend says I have an addiction . And actually , if I had to choose between her and my games ... I'd probably pick football .  
 Person2:  It seems Americans are very passionate about sports . Is this just a part of your culture ?  
 Person1:      Oh , yeah ! I think the love of sports starts when kids are very young . Americans come from many different backgrounds so I guess sports are something we can all enjoy together . 
output: ",1
"input:  Person1:     Repairman.May I come in ?  
 Person2:  Come in please .  
 Person1:      What's the matter , sir ?  
 Person2:  The toilet doesn't flush .  
 Person1:      Let me see.En .. it's right now.You can try it .  
 Person2:  Wonderfull.Thanks a lot .  
 Person1:      You are welcome . 
output: ",1
"input:  Person1:     Are you excited about your trip next month ?  
 Person2:  Yes and no . I can ' t wait to go to Europe , but at the same time I am terrified .  
 Person1:      Why ?  
 Person2:  Well , I have acrophobia . I have a chronic fear of flying .  
 Person1:      Oh really ? I have an uncle who is also terrified of flying . It ' s not that bad though , I mean , it is pretty scary to be in this big machine flying through the air at seven hundred miles per hour . I actually have arachnophobia .  
 Person2:  You ' re scared of spiders ? I actually have two more phobias . Acrophobia and glossophobia .  
 Person1:      I guess that explains why you are afraid of flying , but public speaking is not that bad .  
 Person2:  Are you kidding ? When I get on stage , my palms start to sweat , I get really nervous and I can hardly speak .  
 Person1:      Well , I must confess I am a bit claustrophobic . I hate being in an elevator for more than 5 seconds .  
 Person2:  We are such weirdos right ? 
output: ",1
"input:  Person1:     I feel so uncomfortable .  
 Person2:  Are you sick ?  
 Person1:      No . The teacher is dragging the chalk over the blackboard . It set my teeth on edge .  
 Person2:  He ’ ll finish writing in a minute . 
output: ",0
"input:  Person1:     My hair stood on end when I saw the bloody scene .  
 Person2:  What scene ?  
 Person1:      A kitten being run over by a truck . 
output: ",0
"input:  Person1:     Have you ever gotten a parking ticket ?  
 Person2:  I've gotten a few .  
 Person1:      How many is a few ?  
 Person2:  I've gotten about six .  
 Person1:      Have you paid all your tickets off ?  
 Person2:  Yes , I've paid all of them off .  
 Person1:      How much is the fine ?  
 Person2:  It's like $ 130 each ticket .  
 Person1:      That's not cheap at all .  
 Person2:  I got a parking ticket the other day .  
 Person1:      Pay it off , and they'll clear your record .  
 Person2:  I'm going to do that as soon as possible . 
output: ",1
"input:  Person1:     Hi ! Dick . Where are you going ? You're in such a hurry .  
 Person2:  Playground . We're having sports for today's outside class activities . All my classmates have already got there .  
 Person1:      What are you going to play ?  
 Person2:  Some of us will play basketball and some volleyball .  
 Person1:      Enjoy yourself . 
output: ",1
"input:  Person1:     Why are those people crying ?  
 Person2:  They must have just come back from tomb sweeping because today is Tomb Sweeping Day .  
 Person1:      Tomb Sweeping Day ? What is it ?  
 Person2:  Tomb Sweeping Day is a traditional festival in China , on which many Chinese mourn the dead .  
 Person1:      What do they do ?  
 Person2:  People go to the cemetery to pay their respects to the dead . 
output: ",1
"input:  Person1:     That is the most beautiful sunset !  
 Person2:  Let's stop the car and enjoy it for a minute .  
 Person1:      Here is a good place . Let's get out .  
 Person2:  Wow . We don't get to see this in the city !  
 Person1:      Mother Nature is quite an artist .  
 Person2:  Look behind us at the mountains ! They're reflecting pink !  
 Person1:      Amazing . The sun is almost gone and yet there is still color everywhere !  
 Person2:  Where is our camera ? Let's see if we can catch this on film ! 
output: ",0
"input:  Person1:     I'm hungry . Do we have anything to eat ?  
 Person2:  Just a few cookies .  
 Person1:      That's fine with me . 
output: ",1
"input:  Person1:     Room service.May I come in ?  
 Person2:  Come in please .  
 Person1:      This is your breakfast.Can I put it here ?  
 Person2:  Sure.How much is it ?  
 Person1:      That's $ 10 .  
 Person2:  Well , here is the money .  
 Person1:      Sir , you don't have to pay right now.Just sign here and we will charge it to your account .  
 Person2:  Fine . 
output: ",0
"input:  Person1:     Morning , Tom .  
 Person2:  Hi , Mary .  
 Person1:      You seem to be in a hurry .  
 Person2:  Yes . I ’ Ve got a meeting in a minute .  
 Person1:      Okay . I won ’ t hold you up then .  
 Person2:  Right . I ’ ll see you later .  
 Person1:      See you later . 
output: ",0
"input:  Person1:     What do you like to do in your spare time ?  
 Person2:  I am a girl of many interests . I like dance , chess , collecting stamps , travelling and taking photos .  
 Person1:      What kind of dance do you like ?  
 Person2:  I like rumba and tango .  
 Person1:      Great . I am not interested in Chinese chess . It is too difficult for me .  
 Person2:  You can learn Chinese checkers or military chess . Both of them are much easier .  
 Person1:      OK , I will try . As for stamp , don't you think it is an expensive hobby ?  
 Person2:  Yes , it is . But it is full of fun and knowledge . What about you , what do you like to do as hobby ?  
 Person1:      I like gardening . I take care of them everyday . I like those flowers and the swing in my garden . If the weather is nice , I would like to lie on the lawn .  
 Person2:  Sounds pleasant . 
output: ",1
"input:  Person1:     You really should stop smoking , you know .  
 Person2:  I know . I know . I don ’ t smoke too much , though .  
 Person1:      How many cigarettes do you smoke a day ?  
 Person2:  About a pack , more if I drink .  
 Person1:      Wow . You ’ re really a heavy smoker .  
 Person2:  No , I ’ m not . My father smoked two packs a day for forty years .  
 Person1:      He died of lung cancer , right ?  
 Person2:  Yeah ... you ’ re right . I really should stop smoking . 
output: ",0
"input:  Person1:     Nice day today , isn't it ?  
 Person2:  Yes , it's beautiful weather we're having .  
 Person1:      We can't complain about the weather recently .  
 Person2:  Yes , the sun shines day after day . It's neither too hot nor too cold .  
 Person1:      I wonder how long this weather can last .  
 Person2:  I hope it will stay fine tomorrow . I'm going to have a picnic with my family . 
output: ",1
"input:  Person1:     Hello , this is United Airlines .  
 Person2:  Hello , I want confirm my flight . My name is Jesse .  
 Person1:      When is your flight ?  
 Person2:  June loth .  
 Person1:      One first class seat on flight YW132 , is that right ?  
 Person2:  Yes , thanks . By the way , what time do I have to start check-in ?  
 Person1:      You are supposed to check in at least one hour beforehand . 
output: ",0
"input:  Person1:     Hey Steve . When's the next time you're going to play golf ?  
 Person2:  I'm going out this Saturday .  
 Person1:      Do you already have a foursome ?  
 Person2:  Unfortunately , we do . Let's plan for something together for Wednesday . We can go right after work .  
 Person1:      That sounds good . Where do you want to play ?  
 Person2:  We won't have much time , so let's play somewhere close to work .  
 Person1:      How about Bellevue ? It's pretty close .  
 Person2:  How much does it cost over there ?  
 Person1:      Twilight rates are 21 dollars .  
 Person2:  That's pretty good . Let's do it .  
 Person1:      Aright . I'll get a tee time for Wednesday at about 4  
 Person2:  Make it 4  
 Person1:      Ok . I'll call you later when I get a tee time .  
 Person2:  Sounds good . I'll see you on Wednesday then .  
 Person1:      Aright . Have fun on Saturday .  
 Person2:  Will do . 
output: ",1
"input:  Person1:     The concert was really great .  
 Person2:  I agree .  
 Person1:      The singing group used to be very popular .  
 Person2:  I can't believe they would play so good . 
output: ",0
"input:  Person1:     I think it is easier to buy a car than to maintain it . What ’ s worse , I just don ’ t trust those vehicle maintenance shops . Sometimes , they overcharge or don ’ t build those parts I have been paying for . Last week , they even tried to persuade me to buy new parts which really need not to be changed . You know , my car is just half a year old and also good brand . I was just wondering about all these .  
 Person2:  There are such shops living on selling parts . I don ’ t like their service either . All they want is your money . But in the long run , they will be losing costumers . Anyway , car service business is new in China . We all have to control what they are doing . Otherwise , they will not improve .  
 Person1:      Is it possible to make a compliant call to some organization what it ’ s someone gets rip-off .  
 Person2:  Yes , there is . Those organizations exist . You always can call a lawyer if you need legal help . 
output: ",0
"input:  Person1:     May I help you ?  
 Person2:  I ’ m not sure where to pick up my ballot .  
 Person1:      I can assist you .  
 Person2:  How are you going to help me ?  
 Person1:      I actually work here .  
 Person2:  Fabulous . Thanks .  
 Person1:      Do you have ID ?  
 Person2:  I have it right here .  
 Person1:      Here ’ s your ballot card .  
 Person2:  Now what am I supposed to do ?  
 Person1:      Just take it to a booth and begin voting .  
 Person2:  Sounds good . Thanks . 
output: ",1
"input:  Person1:     Do you think I should turn down his offer ?  
 Person2:  Yes , it's the correct thing to do .  
 Person1:      But we may not get another partner .  
 Person2:  Even so , we can't do business with him.he ' s not reliable . 
output: ",0
"input:  Person1:     Why did she do that ?  
 Person2:  I have no idea . It was completely out of the blue . 
output: ",1
"input:  Person1:     Daddy , what's next ? What else do we do now ?  
 Person2:  There is a man-made fishing pond nearby . So , What do you think of going fishing there ?  
 Person1:      Great . Let's go . Where is it ?  
 Person2:  Patience , boy . A watched pot never boils . We shall get out fishing stuff first and make some baits , too .  
 Person1:      We have many cookies left here . Can we use them as baits ?  
 Person2:  I don't think fish would like them . Instead , they love earth worms .  
 Person1:      So let's go and catch earth worms !  
 Person2:  OK . I think that's enough for today . Let's go .  
 Person1:      Daddy , do you think we're gonna catch any fish today ? We've been fishing here for more than two hours , and we get nothing .  
 Person2:  That's because you're talking to me all the time . Be patient , or there will be no chance to have sashimi for dinner today .  
 Person1:      I love sashimi . Did mom bring any soy sauce for that ?  
 Person2:  I suppose she did . Be quiet . There is a fish on the hook . Here it is . Look , a big one .  
 Person1:      Cool . Hey , I've got an idea . Why don't we cook it separately ? Half for sashimi , and the other half for grill .  
 Person2:  Great idea . But the fact is we have no barbecue with us . Moreover , the sashimi will be great . So why do we bother to waste time on barbecuing the fish ?  
 Person1:      Well , all right . There is nothing to complain about . 
output: ",1
"input:  Person1:     How do you like Chinese food ?  
 Person2:  It's my favorite .  
 Person1:      What other kind of food do you like ?  
 Person2:  I like Indian food as well . 
output: ",1
"input:  Person1:     So how long do you plan to live here ?  
 Person2:  We'd like to sign a year-long contract , if that's OK .  
 Person1:      Fine by me . Do you know how to read this kind of contract ?  
 Person2:  Yes . We've signed them before . We even brought our chops .  
 Person1:      Great . When in Rome , you guys know what to do .  
 Person2:  We'll sign our signatures , too . And give you our passport numbers along with our ARC numbers .  
 Person1:      That about does it . See you in a week . 
output: ",1
"input:  Person1:     Do you think people still have faith in the government ?  
 Person2:  I don ’ t think so .  
 Person1:      Why is that ?  
 Person2:  The government will never fulfill their promise .  
 Person1:      So it is no wonder people cannot keep faith with it . 
output: ",1
"input:  Person1:     Tell me something about yourself and your past .  
 Person2:  I was born and grew up in hebes Province . I moved to Beijing , where I started taking courses for my MBA . When I completed my degree , I was offered an opportunity working for a financial services company . I've worked there for eight years .  
 Person1:      What was the most significant project you've worked on ?  
 Person2:  I was assigned a project to design a 360 - degree performance system . It was a challenge for a person with a finance background . I met with the technical people and discussed the possibilities and obstacles . Based on that information , I selected a team and created a spreadsheet to manage the project . We got the project done on schedule . I was rewarded for outstanding results and was able to share the honors with the team .  
 Person1:      What finance experience makes you qualified for this position ?  
 Person2:  For the past eight years , I have been working in the banking industry . I have a solid understanding of accounting concepts , an analytical mind and a strong attention to detail . I've had a lot of customer service training and experience , and I have been told that I excel in this area .  
 Person1:      How would your coworkers evaluate you ?  
 Person2:  They'd say I was a handworker and a real team player .  
 Person1:      What are your salary expectations ?  
 Person2:  I really need more information about the job before we start to discuss salary . I'd like to postpone that decision until later . 
output: ",0
"input:  Person1:     What is the correct time , please ?  
 Person2:  It ’ s exactly twelve minutes past seven .  
 Person1:      When will you lecture begin ?  
 Person2:  Begin at 9 o ’ clock sharp . 
output: ",1
"input:  Person1:     Can I take your order , sir ?  
 Person2:  I ’ ll have the kung PAO chicken , please .  
 Person1:      Certainly sir , would you like some rice or noodles with that ?  
 Person2:  Just some fried rice please .  
 Person1:      Ok , would you like some soup as well ?  
 Person2:  No , thanks .  
 Person1:      Thank you very much . Your food will be ready soon . 
output: ",0
"input:  Person1:     Now , you are to board the plane.We ' re sorry that we haven't done much to help you when you stayed in China .  
 Person2:  I appreciate what you have done for me.Everything I have seen here has left a deep impression on me . I really don't know how to express my thanks to you .  
 Person1:      We are ready to help you .  
 Person2:  Will you be kind to say "" Thank you "" to Mr.Zhang and other friends for me ?  
 Person1:      I'd like to . I'm sure your visit will help to promote the friendship and understanding between both of us.Welcome to China again .  
 Person2:  Of course , I will.Well , it's time for me to say goodbye.The plane will take off soon.Hope some day you will come to America for a visit .  
 Person1:      Thank you . I will if I have chance.Goodbye and happy landing !  
 Person2:  Goodbye ! 
output: ",0
"input:  Person1:     London is such a historic city ! There ’ s history everywhere you look . There ’ s nelson ’ s column , built as a monument to one of the Britain ’ s great admirals and his important victory . He won the battle of  
 Person2:  I ’ m looking forward to seeing Westminster abbey , where many historic figures are buried , like Isaac Newton , the great mathematician and Winston Churchill , the great wartime leader .  
 Person1:      Nearby , on the banks of the thames , there ’ s the statue of Boadicea . She fought the Romans when they invaded Britain .  
 Person2:  Women have often played an important role in british history . Queen Elizabeth I built a navy strong enough to fight off the Spanish armada in 1588 . more recently , Margaret thatcher transformed british  
 Person1:      She was a very controversial leader . Are we going to visit the famous tower of London later ?  
 Person2:  There ’ s a lot to see there . Perhaps we should go tomorrow .  
 Person1:      I ’ m looking forward to seeing the famous castle and prison . Many historic figures were imprisoned there in the past . I really want to see the crown jewels too .  
 Person2:  I ’ Ve seen them before . They ’ re quite incredible . If you want to see historical figures in London , there ’ s one place you have to go .  
 Person1:      Where ’ s that ? Oh , I know ! Madame Tussaud ’ s the waxworks museum .  
 Person2:  There you can see british leaders , entertainers , criminals , and royalty .  
 Person1:      Sometimes , it ’ s hard to know who belongs in each section of the museum ! 
output: ",0
